titles,category
남욱 곽상도가 컨소시엄 무산 막았다고 들어 곽 억울종합,Social
에쓰오일 폭발 사고 안전관리 부실 여부 논란,Social
 뉴스파이터젠더 갈등 지적에윤 대통령 정신 번쩍 들었다,Social
 영웅에 보청기 나눈 사업가 년 만에 아버지 무공훈장 받아,Social
가스 점검원들 서울시 면담 요청했다 경찰에 끌려 나와,Social
피싱 피해자인 줄 알았더니잡고 보니 현금수거책,Social
수십억 횡령 새마을금고 다급한 출금 행렬은행 년간 몰랐다,Social
지하철 휴대폰 폭행 징역 년 구형왕따 후유증 주장,Social
살인에 아들과 친구들 동원한 대항소심도 중형,Social
원숭이두창 특징은 심한 발진 해외입국자 세심히 살펴야,Social
전두환 자녀 유산 상속 포기손자녀도 포기 절차 검토,Social
집에서 돈 가져올게요택시비 만원 먹튀한 여성,Social
전두환 회고록 손배 항소심 종결이순자씨에게만 배상권 유지종합,Social
손흥민  네이마르역대급 예매 전쟁에 사이트 먹통,Social
광주서 음주운전 톤 화물차 인도 돌진시민 명 사상,Social
서울대역 내렸더니  걸었다이젠 진짜 서울대역 생겼다,Social
황교익 내외합창단 사진 과 동급 비판에국힘이 내민 사진,Social
권대희 사망 성형외과 원장 대법 간다심 불복 상고,Social
 피살 공무원 유족 대통령기록관 항의방문 의 몽니에 오기 생겨정보 공개하라,Social
낚싯바늘 때문에 덜미 잡힌 필로폰 사범,Social
경찰이다사기범 등친 사기범,Social
명동사채왕 마약 누명 피해자 국가상대 손배소 패소경찰 공모 정황 없어종합,Social
고의적 자해 청소년 사망원인 년째 위명 중 명은 심한 우울감,Social
초등생 아들 둘 살해  법정서 오열경제적으로 힘들었다,Social
출연자와 싸우지 말라던데 초보 앵커라 쉽지 않네요 하하,Social
아줌마와 옥희  엄마와 딸 그들의 년 인연,Social
장성군수 선 도전 무소속  민주당 후보 격돌,Social
전두환 손자녀 모두 상속포기재국이순자씨 상대로만 소송 유지종합,Social
채무자 살해에 아들까지 동원한 대항소심 징역 년,Social
민주당 당비 노조 돈으로 납부기업은행 노조위원장 송치,Social
달리는 차에 뛰어와 몸 틀고 점프역대급 자해공갈 공분,Social
속보 국정원 김정은 집권 이래 종이상 탄도미사일 동시발사는 최초,Social
무려 회 성매매 등 동창 죽음 내몬 대 항소심 징역 년,Social
백화점 영업 중단 위기약속 불이행 대기업 철퇴,Social
영부인 집무접견실 무궁화실 등 선공개일부터 청와대 본관관저 내부 개방,Social
이근 아직 귀국 안한 듯우크라이나 무단 입국 처벌 여부 촉각,Social
남욱 곽상도 하나 측에 전화해 컨소시엄 무산 막았다 들어,Social
법무부의 인사검증 업무 권한 분산에 방점뒀다종합,Social
단독 이번엔 새마을금고 직원이 억 횡령돌려막기하다 제 발 저려 자수,Social
코로나 병상 만여 개 지정해제재유행 때 최대 만 명 예상,Social
에스파악뮤 등 억대 몸값억 소리 대학축제 들썩영상,Social
 김건희 사건 추가 배당관련 사건 공정성 시험대,Social
속보 이은해조현수 첫 재판 연기사설 변호사로 착실히 변론 준비,Social
유희태  완주군수 후보 선대위 국영석 후보측 지지자 명 경찰에 고발,Social
대구 미사용 학교 예정지 곳 지정 해제 검토학교 설립 요구 주민 반발 예상,Social
전화 개통하면 만원 휴대전화 깡 입니다,Social
송경호 체제 대장동 수사 재시동 전망추가 인사 가능성도,Social
곽상도 제가 대장동 관련 돈 달라 한적 있나억울하기 짝이 없다종합,Social
단독 법무부 인사정보관리단 서울 삼청동 설치 유력 검토,Social
김학의 불법 출금 차규근 직위해제에 법적 대응법무부 배려 차원,Social
년간 돌본 중증장애 딸 살해 후 극단 선택 시도한 대 친모 검거,Social
엄마 살해하고 사고로 위장 대 아들 구속,Social
폭염에 살 딸 방치해 숨지게 한 친모 징역 년 확정,Social
 점심 먹자 채무자 부른 뒤 살해  암매장한 대아들도 가담시켰다,Social
이예람 중사 특검보 명 임명수사 준비 본격화종합,Social
연식 제한 갈등 확산중대재해 우려  생존권,Social
맨유는 쓰레기  자막실수에팬들 뜻밖의 반응영상,Social
전두환 자녀 상속 포기손자에게 책임 묻지 않겠다,Social
계곡살인 이은해조현수 사선변호인 선임재판일정 연기,Social
년간의 법정 다툼 전두환 회고록월일 최종 선고 나온다,Social
넘어지면서 목에 과도 찔려 숨진 아내보험설계사 남편의 미심쩍은 부분들,Social
단독 스포티비 운영사 대표 억원 횡령 혐의 송치  로비 의혹은 무혐의,Social
김형찬 노기태 허위사실 공표 고발강서구청장 선거 불법증축 논란,Social
인사 검증까지 하는 한동훈 검찰독재국가로 가나,Social
성기선임태희 경기교육감 후보 토론서 극명한 입장차,Social
명동 사채왕 덫에 마약누명 쓴 대 국가 상대 손배소 패소종합,Social
명동 사채왕 마약 던지기에 년간 누명국가배상 소송 패소종합,Social
번방 성착취물 편 다운받은 대 무죄 선고받은 이유는  ,Social
 동창생 성노예로 부리다 숨지게 한 대항소심서 징역 년,Social
두 아들 살해 친모 경제적으로 힘들었다범행 인정,Social
 지방선거영남호남권 여야 텃밭 흔들림 없다,Social
 지방선거충북세종 대선 연장전 치르듯 혼전 거듭,Social
 지방선거민심 바로미터 대전충남 박빙승부 펼쳐져,Social
지하철버스 통합정기권 나온다최대  환승 할인,Social
호선 노인폭행녀 간호조무사로 일하면서 노인혐오 생겨,Social
민정수석실 삼킨 법무부 민간사찰검찰수사 악용 우려,Social
오미크론 하루 수십만 명씩 번지더니월 사망자 만명 역대 최대,Social
서비스로 콜라 줄 인심도 힘들어요생존 기로에 선 국민 야식 치킨집들,Social
음주운전자 몰던 화물차 행인 덮쳐명 사상,Social
내일 날씨 전국 구름 많고 곳곳 빗방울최저기온 도,Social
용감한인터뷰 혹시 우리집도해커의 먹잇감된 아파트 월패드,Social
지하철 휴대폰 폭행 대 최후진술간호조무사 실습 때 노인 싫어져,Social
도망가면 가족 죽인다 종업원 착취 방 업주 징역년 구형,Social
낚시객이 건져 올린 봉지 속 주사기마약사범 덜미,Social
뉴스 청와대 안이 궁금해일 집무실관저 내부 공개,Social
동거남 흉기로 살해한 대 여성현행범 체포,Social
김종인 인천 서구청장 후보 투기과열지구 해제 촉구,Social
생활고에 아들 둘 살해한 엄마 혐의 인정정말 잘못했다,Social
황운하 토론회서 수억원 전매차익 숨긴 중구청장 후보 허위사실 공표,Social
노재팬 가고 보복여행 온다올여름 일본여행 폭발 조짐,Social
포항 무소속희망연대 국회의원 심부름 꾼 아닌 포항 일꾼을 선택해 달라,Social
손흥민 보고싶은데브라질전 역대급 피켓팅에 서버다운,Social
합의 성관계 이후 성폭행 당했다 신고한 대 여성 집유,Social
점점 현실화되는 법무부 검찰화핵심 간부에  출신 속속 꽂아 넣을까,Social
포항 해도동 조민성 후보 전부 거짓 주민들 즉각 검찰에 고발하겠다,Social
만취해 운전하다 도로에 앉은 남성 숨지게한 대 남성 구속영장 신청,Social
대들 착취한 노예 방 업주징역 년 구형,Social
김종인 인천 서구청장 후보 투기과열지구 해제 촉구,Social
생활고에 아들 둘 살해한 엄마 혐의 인정정말 잘못했다,Social
황운하 토론회서 수억원 전매차익 숨긴 중구청장 후보 허위사실 공표,Social
노재팬 가고 보복여행 온다올여름 일본여행 폭발 조짐,Social
포항 무소속희망연대 국회의원 심부름 꾼 아닌 포항 일꾼을 선택해 달라,Social
손흥민 보고싶은데브라질전 역대급 피켓팅에 서버다운,Social
합의 성관계 이후 성폭행 당했다 신고한 대 여성 집유,Social
점점 현실화되는 법무부 검찰화핵심 간부에  출신 속속 꽂아 넣을까,Social
포항 해도동 조민성 후보 전부 거짓 주민들 즉각 검찰에 고발하겠다,Social
만취해 운전하다 도로에 앉은 남성 숨지게한 대 남성 구속영장 신청,Social
대들 착취한 노예 방 업주징역 년 구형,Social
동거남 살해한 혐의 대 여성 검거 경찰 술 마시다 다툰 듯,Social
내일부터 개방되는 청와대 본관 미리보기,Social
누구는 셋방 살고 누구는 임대 주고지자체 청사의 두 모습,Social
광운대 자격미달 지원자 교원 채용교육부 감사서 적발,Social
빽 있다던 지하철 휴대폰 폭행 대 재판서 눈물,Social
개인파산 급감 알고보니사채 써야할 판 자영업자 하소연,Social
막힌도로서 툭 나온 오토바이와 쿵내가  과실영상,Social
서울공고 교직원 추락사중대재해법 처벌 대상 보니 조희연,Social
남욱 곽상도가 하나은행 회장 전화해 컨소시엄 깨질 위기 막았다고 들어,Social
성매매 속여 채팅 유인폭행당한 여장 유튜버,Social
남욱 김만배로부터 상도형이 컨소시엄 무산 막았다고 들어,Social
원숭이두창 전세계 확산 유럽여행 주의보,Social
생활고에 초등생 두 아들 살해한 엄마 첫 재판서 정말 잘못했다,Social
남욱 검찰이 선처 약속해 귀국했는데 돌변 회유 없었다,Social
왕따 당한 탓 간호조무사 실습 때 노인 싫어져 호선 폭행녀의 변명,Social
진보 교육감 전성시대 막내리나곳곳서 보수후보와 접전,Social
함양군 지선 무소속 연대 명 향방 주목,Social
다이어트 열심히 해도 부분 비만 왜 그대로이것부터 해야,Social
친모 사고사 위장 혐의 대 아들 한 번이 아니었다,Social
모르고 받은 택배가 마약 그래도 처벌,Social
국제학교 입시 복마전채드윅 꼭 보내줄게 믿고 건넨 억대 학원비 사기일까 판도라,Social
김은혜김동연 비방전 갈수록 과열거액후원금  재산 허위신고,Social
주 임신부에 난임주사 투여황당한 의료진 실수,Social
정부 연금개혁 국회 주도로사회적 합의 어려워,Social
개인파산 감소 착시였나채무유예 빚 폭탄 터진다,Social
단독 노조 돈으로 민주당 당비 냈다 기업 노조위원장 검찰 송치,Social
내일 더위 식혀줄 비소식전국 구름 많아,Social
남양주 개물림 사망사건 견주 년 만에 구속 기소,Social
지그재그 내달리던 음주운전 화물차 인도 돌진시민 참변종합,Social
명 사망 안철수 대선 유세차량 불법개조 업체 관계자 명 송치,Social
오세혁 경산시장 후보 무소속 돌풍이 불고 있다 지지호소,Social
전두환 회고록 손배 항소심 년 개월 만에 변론 종결,Social
김학의 출금 의혹 차규근 직위해제법적 대응  적법 인사종합,Social
동창생 성노예로 부리다 숨지게 한 대 항소심서 징역 년형,Social
영상 계단 밑에서 현금다발을도움 주려 신고했다가 범인 잡았다,Social
말다툼하다 동거남 흉기로 살해한 대 여성 체포,Social
박종근 신임 제주지검장 검찰 수사권 필요성 증명하겠다,Social
단독 장애인의 날 수업서 담임교사 우리 반에도 장애인 있다승민이 따돌림이 시작됐다,Social
피해자인 줄 알고 신고했다가보이스피싱 수거책 잡았다,Social
죽을 죄 지었다 생활고에 두 아들 살해한 엄마 첫 재판서 혐의 모두 인정,Social
남욱 김만배 곽상도가 컨소시엄 무산 막았다고 해,Social
온라인서 판치는 김건희 도용 쇼핑몰이것도 김 여사 잘못이라는 황교익,Social
바다에 버린 마약 주사기낚시객에 덜미,Social
월 사망자 역대 최다로 처음 만 명 넘어이유는,Social
이준석 이재명 저격수 된다,Social
담당 형사다보이스피싱 조직 등친 대,Social
전두환 자녀들 상속 포기손자까지는 역사적 책임 묻지 않겠다,Social
학부모들이  보고 뒷말교사라고 사생활까지 맞춰야 하나요,Social
현대일렉트릭현대건설기계 노사 임단협 차 잠정합의,Social
프레스룸 날씨 오늘까지 낮더위 이어져요 밤부터 곳곳 비,Social
너무 미안해뇌병변 딸 살해한 친모의 오열,Social
동거남 흉기 살해한 대사람 찔렀다 직접 신고,Social
직업의 재발견 꿈을 짓는 사람들 목수,Social
유우성 보복기소 검사 검찰발 기사 숨기고 거짓 해명,Social
빈 자리 있는데 거리두기 불만 식당서 난동 대심서 징역 월,Social
개 나라 확산 원숭이두창 국내 유입 대비 본격화,Social
단독 새마을금고 직원 년간 억 횡령나도 걸릴까 봐 자수,Social
법무부 인사검증 조목조목 해명에도 공안통치 비판 봇물종합,Social
노인 싫어해 지하철 휴대폰 폭행녀 왕따 후유증 호소,Social
축제 슈퍼위크 대학가 들썩티켓학생증 거래 과열종합,Social
성폭행 무혐의 유명 영화감독 맞고소 취하,Social
대 아들과 채무자 살해암매장 대 항소심 년형,Social
년 간호 중증 장애 딸 살해한 친모 오열정말 미안해,Social
후보자 명 중 명만 참여 대구시장 후보자 토론 시끌,Social
초등생 딸 년반동안 등교 안 시킨 아빠법정서 한 이상한 변명,Social
발달장애 죽음 반복돼선 안돼 추모물결 잇따라,Social
이번에는 꼭 성공 누리호 차 발사 월 일,Social
 나 경찰 빽 있다 대 여성 징역 년 구형,Social
윤형선 계양을 후보 선대위 이준석 대표 선거운동원 임명,Social
정신 진단 받아볼 걸 후회 지하철서 대 폭행한 대 여성 왕따 후유증 호소,Social
전주에서 동거남 흉기로 찔러 살해한 대 체포,Social
문 전 대통령 사저 마을 주민들 집회로 못 살겠다 호소,Social
지그재그 내달리던 화물차 인도 돌진시민 참변,Social
파일 일일이 확인 안 한듯 아동 성 착취물 편 보관한 대 무죄,Social
민주 성남 수사는 선거 개입정부 정치보복 중단해야,Social
남욱 김만배 상도 형이 컨소시엄 무산 막아줬다 했다,Social
우리 만나게 해주세요실종아동부모 모두 하고픈 말,Social
오늘의 운세 월 일 목요일 음력 월 일 ,Social
호선 폭행녀 최후진술 간호조무사 실습때 노인 싫어졌다,Social
용변 보다가 따끔변기 속 뱀에 엉덩이 물린 말레이 남성,Social
편히 쉴 우리 집 없나요 멸종위기종 고리도롱뇽 수난시대,Social
년 만에 순경치안정감 송정애 나는 여경이 아닌 경찰이다,Social
대낮 도심서 음주운전 화물차 인도 덮쳐광주서 명 사망명 부상,Social
새마을금고 대 직원 수십억원대 횡령 사실 자수확인된 피해액만 억원,Social
경찰 빽 있다던 지하철 폭행녀 왕따 당해 후유증징역 년 구형,Social
중대본 회의에 올라간 원숭이 두창변이 가능성은 백신치료제는 있나뉴스룸 예고,Social
돌려막기 수법으로 억 빼돌린 새마을 금고 직원피해자 십여명종합보,Social
전두환 자녀 상속포기손자녀 상속받는다면 이는 취하하겠다,Social
단독양주시 고형연료 발전소 불허가 패소 판결에 항소 결정,Social
년간 억 횡령새마을금고 직원 자수,Social
영상 좌회전하던 버스가 끼어들기 과잉 단속 논란에 경찰은,Social
말다툼 끝 홧김에동거남 흉기로 찔러 살해 대 여성 체포종합,Social
양산 사송지구 아파트 공사로 멸종위기종 고리도롱뇽 수난,Social
항상 투명해야 하는 각막 급하면 세포 출동한다,Social
시속  폭주 운전 사고로 명 사상대 금고형,Social
양재동복정역 구간에 중앙버스전용차로 들어선다,Social
어린이집 관둔 교사 아동 평균 수준 낮아져부모 학대도 심각 토로,Social
동거남에 흉기 휘둘러 숨지게 한 혐의 대 붙잡혀,Social
단독양주 고깃집 환불요구 행패 목사 모녀 벌금형 구형,Social
의료진 갈라치기 간호법 제정 철회하라 부산경남 의사간호조무사 궐기대회,Social
법무부 한동훈 인사추천 소통령 논란에왜곡된 주장 반박,Social
장날 르포 장수군수 후보들 장수시장서 민심 잡기 경쟁,Social
 삼성 반도체 세정 기술 해외유출 적발전 연구원 등 구속기소,Social
정의선 회장 내달 대우와 사돈 맺는다,Social
법무부 인사검증 법 위반 논란에 검사 파견 꼼수 합법화까지,Social
정경심 재판 위증 의혹 최성해 전 동양대 총장 불송치,Social
 콘텐츠 빼돌려 돈 쓸어 담은 중국인이 년간 저지른 일,Social
돈 있으면 때려봐 폭력전과 범 대 술취해 행패 부리다 징역 년,Social
검찰 대들 착취한 노예방 업주 징역 년 구형,Social
소수점까지 같은 지지율원주시장 선거 초박빙 지방선거 초점,Social
박종근 제주지검장 불법체류자 범죄 경찰과 긴밀 협조,Social
영상 건물 관리인의 촉 보이스피싱 피해자인 줄 알고 신고했는데,Social
빗발친 우박에 풍년 기대 와르르경북 과수농가 망연자실,Social
단독론스타  판정은 월 이후로년 분쟁 결과 초읽기,Social
경북교육감 임종식 후보 압수수색은 왜 받으셨어요 학생 질문에 곤혹,Social
살아있어 미안귀국 앞둔 이근 에 올린 글,Social
단독 한 건당 만 원대 보이스피싱 현금 수거책 구속,Social
누리호 차 발사 월 일실제 위성 싣고 우주로,Social
넥타이안경 이어 시계까지 한동훈 시계에 마니아들 관심,Social
햄버거 세트로 못 먹나탄산 이어 감자튀김 대란 우려,Social
영상 붐대 꺽이면서 쿵출근시간에  크레인 전복,Social
친모 사고사 위장 대 아들 과거에도 고의사고 시도 정황종합,Social
새마을금고도 횡령 사건 년간 억 빼돌린 직원 자수,Social
결정의 시간 다가오는데 광주광주일보 선거보도 아쉽네,Social
정부 여름 재유행 하루 확진 만만명 예측원숭이두창 차단 더 강화,Social
억 가짜 세금계산서로 작업대출검찰 보완수사로 사기단 적발,Social
당사자는 우린데교사학생 목소리는 어디 있나요키워드로 본 교육감 선거,Social
전두환 자녀들 유산 상속 포기손자녀들에게까지 책임 묻지 않겠다,Social
명동 사채왕에 누명 대 국가 상대 소송 패소,Social
씨젠 전세계서  생활검사 캠페인 나선다,Social
장수 야산서 군수후보 지지금품제공 의심  음독생명 지장 없어,Social
말다툼 끝에동거남 흉기로 찔러 살해한 대 여성 체포,Social
명동 사채왕 사건 연루돼 년간 누명국가배상 소송 패소,Social
년 전 성폭행 무혐의에 유명 영화감독 맞고소 취하,Social
영상 무게 톤 대형 항타기 도로 덮쳐 아찔,Social
여년 방치돼 지역개발 발목잡은 주인 모를 필지 소유자 찾는다,Social
청소년 인구 쪼그라드는데다문화 학생 년 만에 배 급증,Social
제주 평화로 걷던 대 여성 렌터카에 치여 숨져,Social
표적이 된 전교조전교조 교육 은 혐오 표현,Social
남욱 김만배 상도형이 컨소시엄 무산 막아줬다고 말해,Social
남욱 검찰 애초 자진귀국시 선처 약속입장 돌변,Social
대낮에 아파트서 동거남 흉기로 살해한 대 현행범 체포,Social
양배추 가격만 치솟는 채솟값에 시민들 시름,Social
검찰영풍 재판 준비부터 날선 공방카드뮴 유출 책임 입증 관건,Social
영상 젤렌스키 푸틴과 직접 대화만 할 것 나우 어스,Social
 지하철 휴대전화 폭행 대 여성 징역 년 구형,Social
인터뷰 지선 부울경 최연소 출마자 살 대학생이 선거에 나온 이유는,Social
무더위에 살 딸 방치해 사망케 한 엄마 상고 끝 징역 년,Social
인천교육감 선거 과열후보간 의혹 제기고발,Social
경찰 빽 있다던 지하철 폭행재판서 왕따로 후유증 커 호소,Social
일회용컵 보증금 유예에도 시끌,Social
정경심 재판 모해위증 의혹 최성해 동양대 총장 불송치,Social
강용석 양자토론 가처분 신청 심문기일 출석,Social
비닐하우스공장서 전선자전거 등 회 상습절도 대 노숙인 구속,Social
김학의 출금 차규근 직위해제에 반발법무부 적법 진행,Social
빗길 운전 전신주 들이받고 조치없이 도주 혐의 대 무죄,Social
이제는 영어수학코딩의 시대사고력 키우는 교육이 핵심,Social
설악산 지게꾼 임기종씨 기념품 호  대통령 시계 받았다,Social
손길 마다하고 버티다 쓸쓸하게 생 마감한 대 독거 여성,Social
한동훈 교정공무원 인사보수근무환경 등 처우 획기적으로 개선해야,Social
아까시꽃 너머 산불 상흔 오롯이동해옥계 산불 그후,Social
성소수자 군인에 성관계 추궁 수사자료 공개하라,Social
김학의 불법출금 차규근 직위해제에 반발법무부 절차상 문제 없다,Social
탄산가스 부족 때문에 공장문 닫을라울산 산업계 대란 우려,Social
김학의 불법 출금 차규근 직위해제법적 조치 예정,Social
바다에 버린 마약 주사기낚시 바늘에 걸려 덜미영상,Social
우리딸 미안해 년 돌본 암말기장애 딸 살해한 엄마 눈물,Social
나 경찰 빽 있다 검찰 지하철 휴대전화 폭행녀에 징역 년 구형,Social
축의금만 하루 만원미뤘던 결혼식 쏟아지자 난감하네,Social
번지시선 윤 대통령 첫  주재규탄확장억제 조치 ,Social
남욱 김만배 상도형이 컨소시엄 무산 위기 막아줬다고 말해,Social
폭행 혐의 바이든 경호원 이미 미국 갔는데 처벌 어떻게,Social
관가 퍼진 한동훈 포비아법무부 독립성 보장 이례적 해명,Social
안철수 유세차량 불법 개조 업체 관계자 명 검찰 송치,Social
민주당 인천시당 이영훈 국힘 미추홀구청장 후보 거짓선동 멈춰라,Social
작년 저임금 근로자 비중 로 줄어년 연속  미만종합,Social
지하철서 스마트폰으로 노인 수차례 가격징역 년 구형,Social
뉴스 한미 정상회담 얻은 것과 잃은 것은,Social
독일 원숭이두창 감염자접촉자 주 격리 권고유럽 확산 가능성,Social
병원까지 갔다 제발 멈춰라 사저 주민들 극우에 집단항의,Social
차례 성매매 강요학대동창 숨지게 한 대 항소심서 징역 년,Social
한동훈 법무부 간부 간담회 소집교정공무원 처우 개선 지시,Social
명동 사채왕 휘말려 마약범 누명국가상대 손배 청구 심서 패소,Social
거제시장 선거전 국민의힘 박종우 청색등  민주당 변광용 적색등  ,Social
대구시장 후보가 쏘아올린 부대 이전 이전 보다 쉬울까,Social
반칙왕 우승희 후보이보라미 정의당 영암군수 후보 직격,Social
대학교 내 이것 덕분에 우울증 극복했습니다,Social
오토바이 폭주족 경찰 조롱해도과잉진압 우려 소극적 대응 논란,Social
베트남 등 개국 단체관광객 양양공항서 무비자입국 가능,Social
이용섭 광주광역시장 임기 말 알박기 인사 강행 논란,Social
동업자 속이려노원구청 공문서 위조 건설업자 실형,Social
황운하 김광신 수억 소득세 설명 못한 것은 허위사실 공표,Social
층 규제받던 천호동 구시가지 층 아파트 재개발,Social
전두환 자녀 상속포기손자에게까지 역사책임 묻진 않겠다,Social
안철수 대선 유세버스 사망사고 업체 대표 구속 송치,Social
정의당 광주시의원 명맥 끊길라다시 한번 기회를 배 사과,Social
남양주 개물림 사망사건 견주 년 만에 구속기소종합,Social
제주 대 무면허 폭주족 단속 경찰에 칭찬 쏟아진 이유,Social
차량에 천만 원 현금 모 장수군수 후보 자원봉사자 구속,Social
아동학대 혐의 유치원 교사 항소심 심 집유 깨고 무죄,Social
단독 피아니스트 번째 음주운전으로 실형 선고,Social
항생제 클로폭톨 코로나 치료제로 개발되나,Social
대낮 만취 대 운전 트럭 인도로 돌진명 사망명 중상종합,Social
검찰  명예회복 절차 착수전 검찰청 점검 나설 것,Social
계곡살인 이은해 사선변호인 선임첫 재판 내달 일로 변경,Social
유세버스 일산화탄소 중독사고불법 개조 업체 관계자 명 검찰 송치,Social
 치마 입은 여성만 골라 불법 촬영롯데월드 누군가 오해했다,Social
세 딸 폭염 속 사흘 방치 숨지게 한 엄마 징역 년 확정,Social
성노예로 부리며 폭행 협박 동창생 죽음 내몬 악마 형량 늘었다,Social
동창생 성착취 대 여성 항소심서 년 추가 징역 년형,Social
강용석 양자토론회 명백히 공정성 상실가처분 인용될 것,Social
년간 억원 빼돌린 새마을금고 직원 자수횡령금 사용처 확인 중,Social
