titles,category
음주운전자 몰던 화물차 행인 덮쳐명 사상,Social
창녕군수 선거 후보 매수 의혹 증폭  김부영 후보 사퇴 촉구,Social
누리호 차 발사 월일이번엔 위성 싣고 우주로 간다,Social
일반의료체계 전환 속도 정부 코로나 병상 만여개 감축,Social
영상 억 이상 썼다 유명 연예인 총출동한 대학 축제 슈퍼위크,Social
 코로나 금융제도 허점 악용 억대 대출 사기 규명,Social
창원시 송수관 파손복구 완료일부 지역은 밤까지 단수,Social
삼성전자 자회사 개발 반도체 기술 중국 유출 전 연구원 등 명 기소,Social
유세차량 로고송 커 선거운동원 폭행 대 여성 입건,Social
빚 떠안고 형사처벌까지 휴대전화 내구제 대출 주의보,Social
이시각헤드라인 월 일 뉴스현장,Social
날 무시해서 이유로 직장동료에 흉기 휘두른 대 검거,Social
법무부 한동훈 인사검증 중간보고 안 받는다,Social
지난해 아동 실종신고 만건명은 년 넘게 못 찾아,Social
노동장관 근로시간 관련 현장 간담회노사 선택권 확대,Social
검찰 보완수사로 자영업자 사업자대출 사기 일당 검거,Social
귀를 찢는 소음에 어느새 난청 블랙이글스 소음대책 촉구,Social
중증 장애인 딸 살해 혐의 대 여성 같이 살지 못해 너무 미안,Social
만취  경운기 덮친뒤 뺑소니새벽 일 나가던 부부 참변,Social
이정식 고용장관 선택적 근로시간 확대 속도현장 소통 행보,Social
검찰 코로나 틈타 가짜 세금계산서로 억원 불법 대출 받은 조직원 기소,Social
시민단체 김은혜 경기지사후보 고발에 인사청탁하고 부인,Social
고용장관 주시간 애로현장 찾아 근로시간 선택권 확대,Social
정부 코로나 여름철 재유행 규모 만만명병상 문제 없을 것,Social
변기 물 내릴 때 한 번쯤 생각해야 할 사람들 파리로 가는 길,Social
단독신풍제약 비자금 조성 임원 검찰 송치창업주 공모 혐의 인정,Social
청와대 불상 이번엔 고향 경주로 반환될까청와대 개방으로 여론 다시 커져,Social
휴대전화 넘기고 급전 빌리는 내구제 대출 조심하세요,Social
횡령 또 횡령 이번엔 새마을금고 최소 억원,Social
삼성 자회사 반도체 기술 에 빼돌려 억 챙긴 일당 기소,Social
광주시교육감 후보 자 단일화 무산정성홍 후보 거부,Social
광주 건설노조 펌프카 사망사고 책임자 처벌하라,Social
새마을금고도 내부 횡령억 빼돌린 직원 자수,Social
폭행당한 여장남자 유튜버  낚는 콘텐츠 잠정 중단,Social
년 돌본 중증장애 딸 살해한 친모 너무 미안해,Social
새마을금고도 횡령 사건 터졌다 고객 돈 억 빼돌린 직원 자수,Social
검찰 독재국가로 가나 민변 법무부 인사검증단 신설 비판,Social
코로나 휩쓴 월 사망자 통계 작성 후 월간 최다월간 자연감소 만명 넘어,Social
코로나 병상  감축긴급치료병상으로 재유행 대비 가능,Social
에너지연구원 분이내 초고속 충전가능한 알루미늄 배터리 개발,Social
폭염에 세살 딸 혼자 두고 일 집 비운 엄마징역 년 확정,Social
광주 아파트 붕괴 현대산업개발 대표 입건,Social
검찰공화국 비판에 인사정보관리단 제의 장소 설치 독립성 보장,Social
바다에 버린 마약 주사기낚시꾼 바늘에 걸려 덜미,Social
음주운전 차량 부부 탄 경운기 들이받아남편 사망,Social
윤석열 대통령이 찾은 대구 따로국밥집은 년 문을 연 원조식당,Social
윤석열 대통령 온다고지역 언론 취재 막은 세계가스총회 조직위현장에서,Social
대전지검 년간 한국 방송콘텐츠 불법유통한 중국인 명 입건,Social
치솟는 채솟값에 현장도 시름가격도 쉽게 못 올려요,Social
초등생 화장실 뒤따라가 동창생 불법촬영처벌은 교내 봉사 시간,Social
단독결혼 약속 여성 시간 감금폭행 대 남성 구속,Social
한동훈 법무부 차규근 직위해제 김학의 불법출금 기소 개월만,Social
경찰 광주 아이파크 붕괴사고 관련 현대산업개발 대표이사 입건,Social
민변 인사 검증 맡은 법무부 비판검찰 독재국가로 가나,Social
여자친구 집으로 불러 목 졸라 살해시도 대다른 남자 만나는거 같아서,Social
남양주 개물림 사망 사건 견주 년 만에 구속 기소,Social
발달장애인 가족의 연이은 자녀 살해 비극국가는 없었다,Social
또 터진 횡령최소 억 빼돌린 새마을금고 직원 나도 걸릴까봐 자수,Social
남양주 개물림 사망사건 견주 년 만에 구속 기소,Social
롯데월드 부산서 몰카 촬영 글 확산촬영한 영상 확인해 봤더니,Social
민주당 의원들 경찰청 항의 방문성남 수사는 불공정 선거 개입,Social
김포검단시민연대 일 김포팔당 공약 추진 걷기대회,Social
주력 반도체 기술 에 빼돌려 억원 챙긴 일당 구속기소,Social
새마을금고서 또 내부 횡령최소 억 빼돌려,Social
번방 성착취물 편 받고도 무죄파일명만으로 내용 몰랐을 것,Social
허향진 제주지사 후보 오영훈 제공항 명확히 밝혀야,Social
참여연대 법무부에 인사검증권한 부여 반대 의견서 제출,Social
인천공항서 첫 날갯짓  에어부산 인천나리타 노선 신규 취항,Social
경실련 광역지자체장 후보 명 중 명이 농지보유소명해야,Social
추락 헬기 정비사 박병일씨 명에게 선물한 새 생명,Social
대장동 개발 뇌물 혐의 공판서 남욱 김만배가 곽상도 컨소시엄 무산 막아줬다고 해,Social
월경불순 간호사들에겐 너무 흔한 일이에요,Social
금전문제로 다투다 어머니 계단서 밀어 살해한 혐의 대 구속,Social
나도 걸릴까봐 새마을금고 직원 억 횡령 자수했다,Social
택배노조 매주 월요일 부분파업계약해지 통보 여전,Social
채팅으로 남성 유인 방송하던 여장 유튜버폭행 당한 후 중단한 사연,Social
대낮 만취운전 대 인도로 돌진명 사망명 중상,Social
거리두기 풀리니 음주운전 고삐도 풀렸다,Social
광주화정아이파크 붕괴사고 현대산업개발 대표 입건,Social
대법 주택개발사업 중단된 것 아니라면 조합원 계약 해제 불가,Social
짝퉁 피해 잇따르지만온라인 플랫폼 업체들 우린 책임없다,Social
강용석 후보 김은혜 거부해 단일화 가능성 거의 없다,Social
새마을금고 직원 최소 억 횡령 경찰 자수상급자도 조사,Social
뛰는 놈 위 나는 놈 경찰 사칭해 보이스피싱 조직원 돈 가로챈 대,Social
바람 핀다 의심 여자친구 목 조른 대 남성 검거,Social
프로필정상화 공군총장 내정자 최우수 조종사 출신 작전통,Social
원숭이두창 해외 감염 속출국내 환자 나와도 파급력 없을 듯,Social
건설현장 내 타설 장비 사망 사고 경영자 처벌을,Social
우크라 탈출한 고양이 윤기처럼전쟁재난서 동물도 보호받을 수 있을까안녕 애니멀,Social
포항서 대형 크레인 넘어져주변 시설물 파손종합,Social
제주 평화로 걷던 대 렌터카에 치여 숨져,Social
법무부 인사검증 한동훈 소통령 논란 일자 왜곡된 주장 반박,Social
포항 동빈내항서  규모 항타기 도로 덮쳐한때 도로 통제,Social
사상 최대 이익 올린 에쓰오일 노동자 사망 사고는 되풀이,Social
천안에서 국민의힘 선거운동원 유세 도중 폭행 당해,Social
프로필이종호 해군총장 내정자 합동해상작전 전문가,Social
원주 방문한 정세균 민주당 삼총사 선택해 달라,Social
삼성 자회사 반도체 기술 중국에 유출해 억 챙긴 일당 기소,Social
대 어머니 살해 대 아들 구속화재교통사고 연관성 수사,Social
최소 억 횡령 새마을금고 직원 경찰 자수압박감에 자백,Social
카페 턴 대 중국인 다른 카페서 커피 마시다 피해자에 발각,Social
군산대 캠퍼스에 일제강점기 조성 인공동굴 기 확인,Social
김동연 버스지하철서 내려 택시 타면 원 할인,Social
낮은 금리로 바꿔줄게 서민 두번 울리는 보이스피싱 범죄 기승,Social
권도형 테라폼랩스 집 찾아간 루나 풀매수 코인방송  검찰 송치,Social
민주당 토론서 김동연 거액후원금 의혹 발언한 김은혜 고발,Social
청와대 불상 돌려주세요 뉴시스,Social
민주당 국수본에 항의 성남 수사는 정치보복선거개입,Social
프로필김승겸 합참의장 내정자 한미 연합작전 전문가,Social
무시했다는 이유로 직장동료들에게 흉기 휘두른 대 검거,Social
금리 또 올린다고코인 존버벼락거지 외친 빚투영끌족 한숨만,Social
돌려막기로 억 횡령한 새마을금고 직원 경찰에 자수,Social
박상돈 국힘 후보 천안 부동산 조정대상 지정 해제해야,Social
나를 무시해직장동료 명에게 흉기 휘두른 대 검거,Social
대 아들까지 동원해 지인 살해 대 항소심서도 징역 년,Social
데일리 북한이틀째 사망자 명 봉쇄격폐 조치는 유지,Social
어떻게 이런 일이신호대기 중 탱크가 꽝 수리비가,Social
이근 내 욕 열심히 했냐 살아 있어서 미안 직접 전한 근황,Social
현장 속으로 현대중공업 최고 경영진 소통 이어가며 현장 새바람,Social
원주 찾은 정세균 기호 번 원창묵이광재구자열 삼총사 선택해 달라,Social
비자금 조성 의혹 신풍제약 임원법인  송치,Social
민변 법무부 인사정보관리단 신설 비판 검찰 독재 국가로 가나,Social
낚싯바늘에 걸린 마약 주사기 수십 개 조직폭력배 명 구속,Social
스브스뉴스 강원도 이름이 바뀐다고 년 만에 강원도 이름 바뀌는 이유,Social
민주당 심장부 광주서 제당 경쟁 치열국힘정의진보 총력전,Social
삼성전자 자회사 반도체 기술 유출해 억 챙긴 일당 기소,Social
아들까지 동원해 채무자 살해한 대 항소심서 징역 년,Social
단독 한국싱가폴 법인 문닫은 권도형 조세회피처 법인만 살렸다,Social
전북 군산대서 인공 동굴 발견일제강점기 무기고 추정,Social
코로나 이후 첫 선박 명명식일손 부족은 여전,Social
번방서 아동 성 착취물 개 내려받은 대 무죄왜,Social
김학의 불법 출금 차규근 또 직위해제부당한 인사,Social
 안정적 형태의 액체금속 프린팅 기술 개발,Social
수입 곡물 백톤 국산 둔갑영농조합 대표 구속,Social
다이어리 한국 언론 최초 전쟁 중인 우크라이나에 가다,Social
민변 한동훈 장관에 인사 검증 역할까지검찰독재국가 우려,Social
새마을금고에서 고객예금 억 횡령대 직원 자수,Social
어머니 넘어졌다 신고한 아들 모친 살해 혐의로 체포,Social
코로나 신규 확진 만 명대원숭이두창 검역 강화,Social
폭염에 살 딸 방치사망 대 징역 년 확정,Social
친절한 뉴스 국민  안락사 입법화 찬성,Social
틈 사이로 치마 입은 여성 촬영 온라인 제보 글 사실은,Social
대 아들 대동해 채무자 살해암매장한 대심 징역 년,Social
경운기 추돌 음주 뺑소니 대 긴급체포경운기 몰던 부부 사상,Social
 쓰러졌다 신고한 아들 옷에 묻은 피살해 혐의 구속 ,Social
억원대 허위세금 계산서로 대출사기 벌인 일당 무더기 적발,Social
치마 입은 여성이 놀이기구 탈 때만 촬영 부산 놀이공원 불법 촬영 논란의 반전 진실,Social
시간 방치 숨진 세살 딸번개 나간 엄마 년 감형 왜,Social
박선영 후보 욕설 조전혁에 사과 불필요사퇴하라종합,Social
투자자들 또 고소테라루나 수사 어디로,Social
카페 여주인 돈 뺏은 중국인 강도 다른 카페서 커피 마시다 피해자에 들켜,Social
민변 법무부 인사정보관리단 신설 검찰 독재국가로 가나,Social
고기 대신 낚아 올린 마약주사기 필로폰 투약 조폭 명 덜미,Social
방역당국 전문가 올여름 재유행시 만명 이를 것대응 가능,Social
경실련 인천시장 후보 명 대 공약 따져보니,Social
경찰관 사칭해 보이스피싱 현금수거책 등친 대 구속영상,Social
세 복수국적자 해병대 자원입대 무슨 사연,Social
무려 년 동안 한국 방송 불법 송출 중국인 경찰에 검거,Social
지능화되는 몸캠피싱 요즘은 합의금 장사까지,Social
감염병 전문가 이재갑 교수가 말하는 원숭이두창,Social
지역 토박이 민주당  힘있는 재선 의원 국민의힘,Social
아내 몰래 딴주머니 비자금과 부부대화가 출생율에 미치는 영향,Social
원숭이두창 유입 대비 강화 코로나 신규 확진 만 명대,Social
강용석  김동연 채용비리 의혹 당사자 자격 되지 않는 자리 탐한 적 없다,Social
대통령장관상 석권한 발명왕도 놀란 이 발명품 술자리에서 보던건데,Social
흉기로 여사장 위협해 돈 뺏은 중국인 다음날 다른 카페서 발각,Social
제주 평화로서 대 여성 차에 치여 숨져,Social
남욱 김만배 상도형이 하나은행 회장과 통화했다고 말해,Social
대법 주택조합사업 지연됐다고 계약 해제 사유 될 수 없어,Social
김학의 불법출금 기소 차규근 또 직위해제법적 조치,Social
 어린 딸 시간 홀로 방치한 엄마 감형법원 미숙한 상황판단 능력,Social
해외로 반도체 세정장비 기술 무단 유출한 전직 연구원들 기소,Social
휴대전화 넘기고 급전 빌리는 내구제 대출 주의보,Social
뉴스 오늘의 주요뉴스,Social
북 단거리 섞어쏘기는 처음미사일방어망 무력화 노려,Social
오늘 만 명대원숭이두창 검사체계 확대,Social
나도 걸릴까봐새마을금고 직원 횡령 자수 피해액만 억원 이상,Social
어머니 쓰러졌다 신고한 아들 존속살해 혐의 구속,Social
년만에 축제로 대학가 들썩슈퍼 위크에 과열 우려도,Social
부산 영도구서 대 여성 고독사숨진 지 최소 개월 추정,Social
남욱 김만배가 곽상도 컨소시엄 무산 막아줬다고 해,Social
년간 억 횡령 새마을금고 대 여직원 자수,Social
가뭄 장기화에 충남 지역 주민들 고구마 말라 죽고 있다,Social
예쁘다 초등생 성폭행한 대 년 전엔치매 선처받아,Social
명 사망 붕괴사고 경찰 현대산업개발 대표이사 입건,Social
이재명 압색은 선거방해정치보복민주당 경찰청 항의방문,Social
영업제한 반대 심야 시위 주도한 자영업자 대표 약식기소,Social
어머니 계단서 숨졌다 신고한 아들 결국 내가 밀었다 시인,Social
혹시 걸릴까 노심초사억 횡령한 새마을금고 직원 자수,Social
휴대전화 개통하면 만원 대출형사처벌까지 받는다,Social
성남 압수수색은 이재명 죽이기 민주당 경찰청 항의 방문,Social
확진자 투표 시행착오 재발 없다중대본 핫라인 가동,Social
저성과자 퇴사협상 중 변호사 등판 협상 타결의 청신호,Social
피해자인 줄 알았는데 보이스피싱 수거책시민 신고로 덜미,Social
김치 종주국 쐐기 미국 뉴욕주의회서 한국 김치 행사 성황,Social
휴대전화 깡 빚 떠안고 형사처벌까지신종 불법 사금융 주의보,Social
전쟁터인 줄 자주포에 들이받힌 민간 차량 영상,Social
빚 떠안고 전과자 되는 내구제대출경찰 주의 당부,Social
원숭이두창 성행위로 전염감염내과 교수 체액엔 잘 없어,Social
비정규직 임금 정규직의  개선됐지만코로나 실직 영향,Social
포항서 대형 항타기 넘어져 도로 덮쳐출근길 시민들 깜짝,Social
어머니 살해하고 계단서 쓰러졌다 거짓 신고대 구속,Social
치마 입은 여성만 몰래 찍었다부산 롯데월드 불법촬영 해프닝,Social
내성천 무섬마을 모래톱 뒤덮은 검은 물체의 정체 정수근의 우리 강 이야기,Social
남양주 살인견 농장 주인 사건 발생 년 만에 구속 기소돼,Social
김학의 불법출금 혐의 차규근 직위해제 법적 조치할 것 반발,Social
아시아의 자랑 손흥민 대사관 공식  통해 득점왕 축하,Social
금전문제로 다투던 어머니 계단서 밀어 숨지게 한 아들 구속,Social
광주시교육감 후보 자간 단일화 무산종합,Social
술 주문 후 경찰 신고 위협금품 뜯어낸 중학생 명 검거,Social
월 대구는 이미 도 올여름 얼마나 더울까,Social
세 딸 무더위 속 시간 방치한 여성 징역 년 확정,Social
시끄러워 못 살겠다시위 나선  이웃들,Social
전직 은행원위장 언론인 억 원대 대출 사기단 명 덜미,Social
법무부 새우꺾기 막는다외국인보호시설에 인권보호관 신설,Social
장애인 만점의 기적 그 보도들이 놓친 진짜 이야기 해시태그 지역,Social
돈 갚아 세 아들과 친구들까지 동원채무자 암매장했다,Social
민주 의원들 정부 이재명 정치보복 위해 먼지떨이식 수사,Social
검찰 남양주 개물림 사망사건 견주 구속 기소,Social
남양주 개물림 사망사고 견주 사건 년 만에 구속기소,Social
놀이기구 탄 치마 차림 여학생 몰카 신고에 롯데월드 측 오해였다,Social
도시가스 점검원들 에 면담요청 중 경찰이 폭력진압사과해야,Social
군용 수리온 민수헬기로 인증 공공헬기 시장 진입 가속화,Social
피싱 피해자인줄 알고 신고했는데현금 수거책이었다,Social
실종아동  만명 년이상 장기실종도 명,Social
억 가짜 세금계산서로 억 꿀꺽코로나 대출 허점 노렸다,Social
낚시바늘에 걸린 주사기 더미 마약 투약 조폭 명 구속,Social
감히 손가락을 물어 베란다 밖 반려견 던져 다치게 한 주인,Social
김윤태천호성 전북교육감 후보 단일화 입장차 커 결렬가나,Social
다른 남자와 만난다 의심 품고 애인 노끈으로 목조른 대,Social
오세훈 도시경쟁력 공약 발표년 세계 대 도시로,Social
혹시 걸릴까 노심초사억 횡령한 새마을금고 직원 자수,Social
소통령 한동훈 법무부 장관 일찌감치 차기 대권 후보군,Social
소통령 한동훈 패션화법까지 신드롬 권력집중 우려도,Social
금전문제로 다투던 어머니 계단서 밀어 숨지게 한 아들 구속,Social
코로나병상  지정해제하반기유행땐 권역별 병상 공동활용,Social
돈 갚아 세 아들과 친구들까지 동원채무자 암매장했다,Social
민주 의원들 정부 이재명 정치보복 위해 먼지떨이식 수사,Social
검찰 남양주 개물림 사망사건 견주 구속 기소,Social
남양주 개물림 사망사고 견주 사건 년 만에 구속기소,Social
놀이기구 탄 치마 차림 여학생 몰카 신고에 롯데월드 측 오해였다,Social
도시가스 점검원들 에 면담요청 중 경찰이 폭력진압사과해야,Social
군용 수리온 민수헬기로 인증 공공헬기 시장 진입 가속화,Social
피싱 피해자인줄 알고 신고했는데현금 수거책이었다,Social
실종아동  만명 년이상 장기실종도 명,Social
억 가짜 세금계산서로 억 꿀꺽코로나 대출 허점 노렸다,Social
낚시바늘에 걸린 주사기 더미 마약 투약 조폭 명 구속,Social
감히 손가락을 물어 베란다 밖 반려견 던져 다치게 한 주인,Social
 초등생 성폭행 대 아동성범죄만 건과거 치매로 선처받았다,Social
김학의 불법출금 혐의 차규근 직위해제법적대응 예고,Social
단독성주 사드기지에 주민지원 태양광시설 설치 추진,Social
낚싯바늘에 걸린 수십개 마약 주사기상습 투약 조폭들 덜미,Social
대 죽인 살인견에 발뺌한 견주년만에 구속시킨 결정타,Social
 거점 개 보이스피싱 조직원 명 검거,Social
하반기 재유행 만만명 확진 대비해 병상 확보,Social
치마 펄럭 여학생만 찍었다 부산 롯데월드 몰카 신고 전말,Social
인건비 달라 서울시청 진입하려던 민주노총 조합원 체포,Social
단독 비자금 조성 사건 신풍제약 임원  회사 법인 검찰 송치,Social
대 아들 동원해 채무자 살해암매장한 대 항소심도 년형,Social
비브리오패혈증균 첫 검출어패류 익혀 먹어야,Social
루나로 수십억 손실권도형 집 찾아가 초인종 누른  불구속 송치,Social
번방인지 몰랐으면 그만성착취물 개 내려받고도 무죄,Social
강남대로송파대로 잇는 헌릉로 중앙버스전용차로 구축 년 전 구간 개통,Social
보이스피싱범이 낚였다나 경찰인데 만원 등친 대,Social
민주당 대전시당 국힘 한장짜리 공보물 유권자 농락,Social
가족경영 장애인단체의 꼼수지부장은 여동생 오빠는 직원수당 챙기고,Social
피해자인줄 알고 현금다발 세는 보이스피싱 수거책 잡은 관리인,Social
검찰 차량시위 자영업자 단체 대표 벌금 만원 약식기소,Social
경찰 경기도에 관용차 배차 추가자료 요청이재명 수사 가속도,Social
초점남양주 개물림 사망사고 년 만에 견주 기소의미는,Social
도시가스 점검원들 서울시 면담 요청 과도하게 제지당해종합,Social
남양주 개물림 사망사건 년 만에발뺌하던 견주 구속기소,Social
사계절 꽃의 숲 펼치는 서울대공원 시민의 테마파크로,Social
 화장실 몰카 교장에 항소심서도 징역 년 구형,Social
다이어트의 계절빠지지 않는 뱃살 체형 교정을,Social
양담소 재혼한 남편이 알고보니 기러기아빠 그의 아내가 상간녀소송을 한다고 해요,Social
부산 기장군 죽성 드림세트장 대한민국 안심관광지 선정,Social
대구시장 면 충분 홍준표 적합도 여론조사서 ,Social
일 새벽까지 중부에 약한 비강풍 속 더위도 한풀 꺾여,Social
올여름 재유행 때 만만명 확진병상 충분해상보,Social
억대 허위세금 계산서로 대출사기 벌인 명 적발,Social
검찰 가짜 세금계산서로 수십억원 대출받은 조직 덜미,Social
검찰  민주화 운동 피해자 재심청구 명예회복 나선다,Social
한동훈 빈티지 시계에 나토스트랩시계 마니아들 관심,Social
제주도 경찰 음주단속 때 대포차세금 체납 차량 동시 단속,Social
중국 주요 도시 봉쇄로 국내기업 곳 중 곳 더 힘들어졌다,Social
단독 이번엔 새마을금고 직원 억 횡령제 발 저려서 자수,Social
제금융권도 횡령새마을금고에서 억 빼돌린 직원 자수,Social
이장우 대전시장 후보 불법현수막 초조함만 보여줄 뿐,Social
채무자 살해 후 암매장 대 항소심서도 징역 년,Social
노래방서 고교생 살해한 대 항소심도 징역 년,Social
한변 검수완박법은 위헌 헌법소원 제기,Social
국가책임 호소발달장애 가족 추모 분향소 삼각지역에 설치된다,Social
포항 동빈내항 공사현장서  높이 항타기 쿵,Social
오영훈 측 역대 최대 억 규모 추경 편성,Social
매서운 채솟값 상승세현장에선 매출 급감 한숨도,Social
 대기업 사무실서 동료 여직원 불법 촬영대 남성 검거,Social
나토 사무총장의 저격푸틴의 우크라 침공 큰 전략적 실수다,Social
양재염곡세곡 헌릉로 중앙버스전용차로  착공,Social
전교조 아웃은 혐오표현전교조 교육감 후보 명 고소,Social
강남대로송파대로 사이 헌릉로 중앙버스전용차로 생긴다양재염곡세곡 ,Social
대구 지상철서 쓰러진 대 직원이 심폐소생술로 구조,Social
전주 모 고교서 수인성 감염병 의심 환자 명 발생,Social
강남송파대로 잇는 헌릉로 중앙버스전용차로 내달 착공,Social
전주 풍패지관 년 만에 개방고려시대 축조 확인,Social
대검 전국 검찰청에  사법피해자 명예회복 진행 지시,Social
신규 환자 만천 여명원숭이두창 해외유입 차단 강화,Social
포항서 대형 크레인 넘어져주변 시설물 파손,Social
민주당 텃밭 전남 표심 무소속 연대 바람 통할까,Social
제한속도  초과 광란의 질주로 사망사고낸 대 금고형,Social
대 아들까지 동원해 채무자 살해 후 암매장대 심도 년형,Social
필로폰 주사기 바다에 버린 조폭들낚싯바늘에 봉지 걸려 덜미,Social
매일 밤 기계소리 윗집은 모른다 오래된 아파트라면 이것 때문일수도,Social
영동교복정역 중앙버스차로 신설구간 연말 개통,Social
새벽 퀵보드 타고 차털이 시도 대 명 관제실에 덜미,Social
예의 없다며 흉기로 찌를 듯 협박한 대 집유,Social
욕설 그만 이웃들 폭발 시끄러워 못 살겠다 대항 시위,Social
하루에 두 장애인 가정서 비극 전장연 삼각지역에 분향소 설치,Social
검수완박 법안 헌법소원 제기,Social
전 여친 집 창틀에 녹음기 설치한  다른 남자 때문에,Social
저금리 대환대출 미끼중국국내 활동 보이스피싱 개 조직 검거,Social
제주해안 골칫거리 구멍갈파래 알고 보니당뇨비만에 효과,Social
낚시꾼이 건져올린 주사기 마약사범 명 구속송치,Social
