titles,category
조선왕릉서 역사 공부거리두기 풀리니 인기,Social
대낮 만취운전 트럭 행인 덮쳤다명 사망명 중상,Social
굿모닝 날씨오늘 낮더위 주춤중부 강한 바람 주의,Social
단독 김관영 도지사 후보 석사 논문 표절 의혹문장 개 동일,Social
오늘부터 청와대 집무실관저 내부도 관람,Social
처제와 왜 한 침대에부부싸움 중 흉기 휘두른 대 여성 체포,Social
경향 강성 지지자 공격 무서워 민주당 의원 입 다물어,Social
대 폭주족 진압 경찰 고소 위기특진시켜야 응원 쇄도,Social
무궁화실엔 이들 초상화오늘부터 청 본관관저 문 연다,Social
담당 형사다보이스피싱 조직 등친 대,Social
현대차 노조 업무방해 사건 오늘 년 만에 결론,Social
새마을금고에서도 억 횡령년 다닌 직원 경찰에 자수,Social
빅뱅 승리 오늘 대법원 선고심 징역 년 개월,Social
연이자  곧 복구계획 손실 키운 권도형 말들,Social
서대구역 개통 한달반 만에 이용객 ,Social
지방선거김성 정종순 초박빙 예측불허,Social
행정 경험힘센 머슴최대 기초자치단체 수원,Social
단독 술 주문하고 경찰 신고 협박돈 뜯어낸 중학생들 검거,Social
기후환경 리포트 바이러스의 습격인간에 대한 자연의 복수,Social
단독 에쓰오일 폭발사고 인재회사 측 과실 인정,Social
김경수 페북 프로필 사진 양손 하트로 변경사면 예고 해석 분분,Social
원숭이두창 확산유입 막기 위해 검역검사 확대,Social
사적 공간 침실욕실까지오늘부터 청와대 내부 일반 공개,Social
지선인천 현직 박남춘  전직 유정복년 만의 리턴매치,Social
나 경찰이야현금 수거책 돈 가로챈 대 구속,Social
살 딸 폭염에 숨질 때 엄마는 카톡방 번개모임징역 년 확정,Social
친구와 성관계 합의해놓고 성폭행 당했다 신고한 대 여성,Social
한덕수 윤종원 대체 못한다 권성동 고집 피우시냐,Social
지방선거유두석 김한종 오차범위 접전,Social
택시비 만원 나오자 돈 가져올게요 그대로 먹튀한 손님,Social
내부 고발자 보복 폭행욕설 등 위협도,Social
억 전재산 날렸는데 또 살까권도형 새 루나 나온다,Social
지하철서 휴대폰으로 대 남성 수차례 가격한 대 여성에 징역 년 구형,Social
오미크론 확산한 월 사망자 역대 최다,Social
인터뷰 병원균 속까지 로현미경 존재감 커졌죠,Social
동창 감금해 성매매 강요가혹행위 일삼아 숨지게 한 대심서 형량 가중,Social
생활고 이유로 두아들 살해한 대 친모 변호인 남편에 복수하려고 애 죽이는 사람 있나,Social
결혼 약속한 여성 시간 감금폭행한 대 구속 다른 남자와 술마셔 화나,Social
경찰 빽 있다던 휴대폰 폭행녀 법정선 우울증 때문에,Social
휴대폰 소액대출로 수십배 빚더미 내구제 대출의 덫,Social
일반고  켤 때 특목고는 줌교육불평등 키운 원격수업,Social
대법원 임금피크제 위법 여부 오늘 선고,Social
학교유치원에 발암물질 석면 년 넘게 그대로,Social
성매매 등 개 혐의 승리 감형해준 심대법 판결은,Social
분 안에 올게요택시비 만원 먹튀한 여성 영상,Social
심 징역 년 개월 빅뱅 승리 오늘 대법원 선고,Social
부산 강서구청장 선거 흑색선전 과열 양상이지만 대체로 사실,Social
조국 사직 안 받아줘서 월급 받았다 서울대 그런 적 없다,Social
회사원도 은행원도 공무원도 간큰 횡령 잇달아약한 처벌 탓인가,Social
회사원도 은행원도 공무원도 간큰 횡령 잇달아약한 처벌 탓인가,Social
미터 건설 장비 와르르안전지침 없어,Social
변희재 한동훈은 진중권 책 깔아주고 은  찬양제 히틀러와 괴벨스,Social
뉴스 열어보기 북 도발 직후 미 전략자산  폭격기 일본 상공 출격,Social
기술 넘어간 종착지는 중국 국영연구소,Social
반도체 세정장비 유출 혐의 명 기소,Social
검찰 이어 경찰도  친정체제 구축국수본부장도 검찰 출신,Social
임금피크제 노사합의로 도입했지만 차별대법 첫 판단 나온다,Social
임금피크제 수백만명 오늘 대법 판결에 주목하는 까닭,Social
여 차례 성매매동창 죽음 내몬 대  징역 년,Social
감자 싣고 달리던 톤 화물차 쾅대 운전자 다쳐,Social
장애 딸 살해 엄마 미안하다구속영장 기각,Social
법무부 인사검증 민정수석 잔혹사 끊을까한동훈 노터치 약속,Social
추천부터 검증까지  출신이 정부 인사 장악,Social
성매매 알선해외원정 도박 빅뱅 승리 오늘 대법원 선고심선 징역 년 개월,Social
조국 왜 나를 거짓말쟁이로 모나사표낸 적 없다 받지 않는데 어떡해,Social
퀴어축제 서울광장서 열릴까또 시민위원회로 넘긴 서울시,Social
무섭게 오르는 경유생계 막막한 디젤차 운행 업자들,Social
전기차 폐배터리 재사용이 찐 친환경 리사이클링 속도 연중기획지구의 미래,Social
에 기술 매국 삼성 자회사 직원들 기소,Social
여성 명이 일생 동안 아기 명 낳을까 말까 뉴스 투데이,Social
도로 점령한 유세차량 간판 가리는 현수막 도넘은 선거 유세에 시민들 불만,Social
부산서 대 여성 고독사 반년간 몰랐다,Social
호텔서 바닷가서 세대 우리는 놀면서 일해요,Social
부 오늘의 주요뉴스,Social
노동자 파업이 업무방해죄인가년 만에 결론 내리는 헌재,Social
지하철 역무원과 건보공단 콜센터 상담사들이 파업하는 이유,Social
최장 미제사건 파업이 업무방해죄 오늘 년만에 결론대법선 유죄,Social
김만배 돈 없는데 어쩌라고그날 서초동 식당서 무슨일이 ,Social
새벽 시까지 스마트폰쓰는 살스마트폰 중독 초등생 년새 ,Social
사전투표  송영길오세훈권수정 토론 첫 자 대결,Social
노조 특근거부도 업무방해죄헌재 년 만에 결론,Social
서울대서 월급 받아 온 조국공식 사의 표명도 안했다,Social
택배기사 또 뇌출혈사회적 합의에도 여전한 분류작업,Social
화이자  원숭이두창 큰 걱정 안 해상황 지켜봐야,Social
육군  지원 년 새  감소서울대 올해 명 역대 최저,Social
임금피크제는 연령 차별인가오늘 대법원 첫 판단,Social
손흥민이요 공정의 또 다른 이름이죠 세대 에 열광하는 이유,Social
인사정보관리단 법무부 장관 직속인데 독립 운영실현 가능할까,Social
정부 검찰식 경찰 통제기수파괴자문위엔  포진,Social
취임 검찰 수뇌부 검수완박 한 목소리법조계 사전 입법영향평가 필요,Social
다시 찾아온 특수통의 전성시대한동훈 반부패수사부 몸집 키울까,Social
오늘 법사위 간호법 상정 불발결론까지 장기간 갈등 불가피,Social
서울역에서 가장 담배 피기 좋은 곳 어디인지 아십니까,Social
왕장관 우려에 발 뺀 법무부 우리가 인사검증 전담 아냐,Social
결국 또 국민 차 접종여름 재유행 대비책 시급해졌다,Social
차접종 면역 감소 본격화하는데재유행 대안 없는 정부,Social
공무원군인사학연금은 불치병 국민연금보다 더 먼저 수술해야 최광숙의 ,Social
개방된 청와대 속 경주 불상은 아직도 갇혀 있다,Social
장수군수 선거서 현금 덜미 그것도 두 명이나,Social
먹고 살기 힘드네 원앙  잉어,Social
채드윅 국제학교 무조건 입학시킬 수 있다 넉 달치 억 학원비일까 로비자금일까 판결을 열다 판도라,Social
남욱 곽상도가 사업 무산 막아줬다고 들어,Social
너무 미안해 년간 뇌병변 딸 돌보다 살해한 엄마 영장 기각,Social
치킨뼈 화석 플라스틱 화석 나올 지구 쓰레기 지층 파보니,Social
택배기사 또 뇌출혈사회적 합의에도 여전한 분류작업,Social
동창생 성노예로 부리다 숨지게 한 대 항소심서 징역 년,Social
날씨 전국 곳곳 빗방울낮 더위 주춤,Social
성매매 알선 빅뱅 승리 오늘 대법원 선고심 징역 년 개월,Social
한 손엔 검찰 한 손엔 인사모든 길은 법무부로 통한다,Social
세계 최고 공항의 민낯방치된 난민들 배고프고 목말라요,Social
왕따 당했고 간호조무사 때 노인 싫어져 호선 폭행녀 선처 호소,Social
소각장발전소 전국서 님비 몸살선거가 혐오 부추긴다,Social
만 쓰레기산 옆 주민 년 참았다수도권 매립지 전쟁,Social
카페서 공부하다 범법자 돼경찰도 괴로운 코로나 크리미널,Social
법무부 검찰국처럼 행안부에 경찰국 검토독립성 논란 예고,Social
싸이 떼창에 눈물 난다 만 열광년만의 대학축제 들썩,Social
문화재  재산권 검단 왕릉뷰 아파트 월 입주대법 판단은 그법알,Social
특정 연령부터 임금피크제 차별일까오늘 대법 판단,Social
종목 추천 문자가 또내가 주식하는 거 어떻게 알았지,Social
단독조국이 만든 규정 칼대는 한동훈 형사사건 공개금지 개정,Social
르포외식이요 집밥도 무서워요 장바구니 물가 상승에 서민들 한숨,Social
원정도박 등 승리 오늘 대법 선고심 징역 년개월,Social
군산비행장 소음 억 보상앞집 주고 뒷집 왜 빼나 반발 이슈추적,Social
신율 박지현 사과 내용 불분명 감흥도 없어 용퇴 국민이 결정,Social
인간에 대한 예의 없어 서민 진중권 손절 선언,Social
세상만사 보이스피싱범 등친 전직 보이스피싱범,Social
우리 장관 인사 검증을 왜 법무부가 세종 관가도 의구심,Social
괴롭힘 신고했더니 더 높은 상사가 다칠 수 있다 취소 종용합니다 그래도 출근,Social
위안거리에서 짐덩어리로 거리두기 해제되자 늘어나는 유기 동물,Social
영상 종로구 안국동 음식점서 불영업 종료 후 내부 화재,Social
법무부 차 검증 실무만 장관은 중간보고 안받아,Social
단독 이예람 사건 특검보에 유병두이태승손영은,Social
서울 신통기획 호 재개발 천호구역 심의 통과,Social
근로시간임금 체계 유연화 내걸었지만  반발 변수,Social
단독 스포티비 운영사 대표  송치  로비는 혐의 없음,Social
오미크론이 부른 사망 급증 월 만명 넘어 역대 최다,Social
성도착자자살충동 대 자격증 올리자  쏟아졌다이슈탐사,Social
헐거운 가스관이 온난화 주범 거짓말 같다고요 사실입니다,Social
법무연수원 연구위원 명 장관정책보좌관 발령 이례적 인사 뒷말,Social
올여름 일본 여행 수요 폭발 조짐 재팬코로나 보복심리,Social
뭐라도 해야 왕년의 사장님들도 경비 서고 택배 옮겨,Social
개미처럼 벌어주고 설거지용 고무장갑 뭐가 좋나 찾는 은퇴남들,Social
황혼이혼 년새 배 이상 증가 아직 살 날 많다며 개인의 행복 찾아,Social
황혼이혼 년새 배 이상 증가 아직 살 날 많다며 개인의 행복 찾아,Social
진보진영 텃밭 인천 부평구 대 후보간 양보 없는 맞대결,Social
세종 전문가들이 맞붙는 지방선거 표심은 어디로,Social
양재동복정역 버스전용차로로 연결,Social
이르면 여름 코로나 재유행 하루 만만명 확진,Social
경찰 군위군 수십명 선거용 위장전입 의혹 수사,Social
폭염에 아이 시간 방치 번개모임 나간 엄마감형 왜,Social
여론조사 세 이상 명 중 명 김홍규 후보 지지,Social
골칫덩이 길막 선거 현수막 학생 목걸림 사고까지,Social
법무부 한동훈 소통령 비판에 맞불 민정실 겨냥 음지 밀실,Social
돈 달라는 곽상도에 김만배 당장 못 준다며 탁자 내리쳐,Social
배국환 신상진 성남시장 자격 없다준비없이 남의 실적이나 뺏는다며,Social
친모 사고사 위장 대 과거에도 고의사고 시도 정황,Social
이준석 이장우서철모 당선되면 당 차원 적극 지원할 것,Social
목뼈 골절 대 폭주족 경찰 고소시민들은 경찰 잘했다 칭찬 릴레이,Social
단독 에쓰오일 폭발사고 인재회사 측 과실 인정,Social
법원 강용석 뺀 경기도지사 후보 토론 방송금지,Social
천여 차례 성매매 시켰다동창생 숨지게 한 대,Social
부산 초고층 타워 건립 미루던 롯데백화점 영업중단 위기,Social
만취 화물차가 인도 덮쳐 명 사망,Social
양귀비 재배 비닐하우스농작물 절도 신고 순찰 중 딱 걸렸다,Social
전두환 자녀들 이어 손자녀들도 상속포기 검토,Social
남양주 개 물림 사망사건 견주 년 만에 구속재판받는다,Social
호선 휴대전화 폭행 대간호조무사 실습 때 노인 싫어졌다,Social
속보 내일 만명 가능성 신규 확진 만 명 명,Social
날 무시해 대 직장후배 명에게 흉기 휘두른 대,Social
단독 에쓰오일 폭발사고 인재회사 측 과실 인정,Social
법원 강용석 뺀 경기도지사 후보 토론 방송금지,Social
천여 차례 성매매 시켰다동창생 숨지게 한 대,Social
부산 초고층 타워 건립 미루던 롯데백화점 영업중단 위기,Social
만취 화물차가 인도 덮쳐 명 사망,Social
양귀비 재배 비닐하우스농작물 절도 신고 순찰 중 딱 걸렸다,Social
전두환 자녀들 이어 손자녀들도 상속포기 검토,Social
남양주 개 물림 사망사건 견주 년 만에 구속재판받는다,Social
호선 휴대전화 폭행 대간호조무사 실습 때 노인 싫어졌다,Social
속보 내일 만명 가능성 신규 확진 만 명 명,Social
날 무시해 대 직장후배 명에게 흉기 휘두른 대,Social
너무 미안해 년 돌본 뇌병변 딸 살해한 친모 영장 기각,Social
오미크론 정점 찍었던 월 사망자 사상 첫 만명대,Social
코로나 여름 재유행 땐 만만명 병상 대응 가능,Social
삼성 자회사 연구원 반도체 세정장비 기술 억 받고  빼돌려,Social
경북 군위 군수 후보 내 친척인데 지지해줘 돈 건넨 대 구속,Social
술 주문하고 나 미성년자 신고할까요 이렇게 돈 뜯었다,Social
버스 때문에 기분 나빠서 경찰 단속에 한문철도 갸우뚱영상,Social
고의적 자해 청소년 사망원인 년째 위명 중 명은 심한 우울감,Social
화물택배운수 줄파업 예고노동정책 반발 기류,Social
코로나 병상 만여 개 지정해제재유행 때 최대 만 명 예상,Social
경찰이다사기범 등친 사기범,Social
남욱 김만배곽상도 저격컨소시엄 무산위기 해결,Social
낚싯바늘 때문에 덜미 잡힌 필로폰 사범,Social
단독 이번엔 새마을금고 직원이 억 횡령돌려막기하다 제 발 저려 자수,Social
치마 펄럭 여학생만 찍었다롯데월드 몰카사건 전말은,Social
음주운전 화물차에 자전거 타고 가던 시민 참변,Social
 김건희 사건 추가 배당관련 사건 공정성 시험대,Social
송경호 체제 대장동 수사 재시동 전망추가 인사 가능성도,Social
조국 사직 요청 안 받아줘서 월급 받아 서울대 사의 표명 없었다,Social
인천시장 후보 상호비방 듣지도 말자 지방선거 초점,Social
말기암 투병 중증장애 딸 수면제 먹여 숨지게 한 친어머니구속영장 기각,Social
크랩 두창 비축 백신 만 명분 우리가 못 쓰는 이유는,Social
평화로 걷던 대 차에 치여 숨져운전자 입건,Social
몇 잔 안 마셨는데관광객도 음주운전 적발,Social
호남고속도 하행선서 톤 탱크로리 불시간 정체,Social
조선왕릉서 역사 공부거리두기 풀리니 인기,Social
바다에 버린 마약 주사기낚시꾼 바늘에 덜미,Social
중학교 석차 평가 안 하는데학원 장학금 이유로 확인 요구,Social
인사라인에 검찰 출신 수두룩민정실 폐해 더 커질 수도,Social
홀로 남는 전북 특별자치도 추진대안 없나,Social
대낮 음주운전 트럭이 행인 덮쳐명 사상,Social
동창생 회 성매매 시킨 대 항소심서 징역 년형,Social
행정 경험힘센 머슴최대 기초자치단체 수원,Social
학교 절반이 발암물질 석면철거도 아찔,Social
노래방서 고교생 잔혹 흉기 살해 대 징역 년,Social
 사저 방문한 이낙연  출국 계획 보고 드리고 점심 함께했다,Social
기술 넘어간 종착지는 중국 국영연구소,Social
반도체 장비 기술 유출 혐의 명 기소,Social
단독 김관영 도지사 후보 석사 논문 표절 의혹문장 개 동일,Social
친모 사고사로 위장한 아들 과거에도 고의사고 시도 정황,Social
경찰 사칭에 속고 신고에 들통보이스피싱 수거책 잇단 검거,Social
새마을금고 직원 명 년간 억 횡령최근 잇단 횡령 적발에 자수,Social
강용석 가처분 인용김은혜김동연 양자 토론 방송금지,Social
 대형 타워크레인 와르르출근길 운전자들 큰일날 뻔,Social
대낮 만취 트럭기사 인도 돌진명 사상 날벼락,Social
강용석 손 들어준 법원경기도지사 토론 방송금지 가처분 인용종합,Social
양산시장 후보 토론 열띤 공방전 펼쳐,Social
추천부터 검증까지  출신이 정부인사 장악,Social
비만 땐 코로나 위중증 위험 높다,Social
코로나가 부른 잔인한 월사망자 최다,Social
남욱 곽상도가 대장동 컨소시엄 와해 막았다 들어,Social
백운기의 뉴스와이드 고개 숙인 박지현 질타하는 지도부민주당 내홍 계속  김치찌개따로국밥국수윤석열 대통령의 식사 정치,Social
술 주문 뒤 나 미성년자 신고할까요돈 뜯은 중학생들,Social
학생 붙잡아 감금 의혹대학 평가 좋게 받으려,Social
단독 이번엔 새마을금고 직원이 억 횡령돌려막기하다 제 발 저려 자수,Social
권도형의 새 루나 결국 나온다고래 투자자들 압도적 지지,Social
바다에 몽땅 버린 마약 투약 도구 낚싯줄에 덜미 잡혀,Social
에너지 안보 위한 에너지 믹스,Social
포항쓰레기산 원룸알고보니 청년 은둔형 외톨이,Social
온몸 수포 원숭이두창 성행위로 전염 되나 전문가 의견은,Social
법원 강용석 빼고 김동연김은혜 양자 토론 불가,Social
제주지사 허향진 오영훈 제주을 보선 접전,Social
노래방주점서 업주 돈 뜯은 중학생들술 시켜놓고 미성년자다,Social
펜션 피범벅 만든 손님의 일침장사 그렇게 하지 말라,Social
재판 간 고깃집 환불갑질 모녀 배달앱 점 흔한데공론화 너무해,Social
제주시을 여론조사 부상일  김한규  초접전,Social
김주하의 그런데 경찰 수사 일 국민은 속탄다,Social
문어 낚은 줄 알았는데낚시객 바늘에 마약주사기,Social
법원 강용석 가처분 신청 인용김은혜김동연 양자토론 무산,Social
가족이란 학교 밖 청소년 나에게는 꿈이 있습니다,Social
만취 화물차 냅다 인도로마른하늘에 행인 날벼락,Social
밀착카메라 서울 사는데 강원도 후보가문자폭탄의 비밀,Social
전두환 전 대통령 자녀 상속 포기원고 손자까지 책임 묻지 않겠다,Social
법원 김은혜김동연 양자토론 제동강용석 가처분 인용,Social
잇따른 음주운전 사고로 명 사망만취 운전자 명에 구속영장,Social
징계 전력자 잇단 발탁에 공정 외면,Social
전남교육감 여론조사 김대중장석웅  동률 초박빙,Social
피싱범 등친 전직 피싱범경찰 사칭해 만원 빼앗아,Social
어린 직원들이 나를 무시해서직장 동료에게 흉기 휘둘러,Social
국민의힘 포항 남구 책임당원 무더기 강제 탈당 시끌,Social
임신부에게 태아 기형 위험 난임치료제 주사,Social
살인견 견주 발뺌하더니불법 개사육장 주인 맞았다,Social
년 돌본 장애인 딸 살해한 엄마 딸에게 미안해요,Social
현금다발 세는 모습이 수상해피해자 도우려다 피싱범 잡은 시민,Social
이예람 중사 특검보 명 임명이태승유병두손영은 변호사,Social
법원 김동연김은혜만 참여한 토론회 방송금지 가처분강용석 웃었다,Social
원숭이두창 해외 유입 차단 위해 검역  검사 강화한다,Social
 항타기 무너져 도로 덮쳐사고 잇따르지만 안전지침 없어,Social
어머니 계단서 밀어 살해한 아들 구속아버지도 다른 사고로 의식불명,Social
남욱 김만배 과장 많아특히 돈 관련해선 믿지 않아,Social
기 앞 돈다발 피해자인줄알고보니 현금수거책,Social
나 경찰이야피싱범 속여 돈 가로챈 전직 피싱범,Social
확진자 방문 낙인에 폐업까지정부 보상은 겨우 만원,Social
낚시꾼에 딱 걸린 마약사범주사기 개 든 봉지 낚여 덜미,Social
호선 폭행녀 최후진술 간호조무사 실습 때 노인 싫어져,Social
살 피해자 이름 반복검색실검챌린지도 전원 선처,Social
대낮에 만취 화물차 인도 덮쳐자전거 타고 지나던 행인 숨져,Social
시청 면담 요구 노조원 끌어내고 체포경찰 대응 강경,Social
경찰 내부 인사정보 업무 법무부 이관에 불편한 기색,Social
여자 행세한 유튜버 방송 도중 폭행한 대 남성 경찰 조사,Social
이슈체크 원숭이두창 코로나처럼 변이 백신치료제는,Social
대낮 만취한 트럭 인도로 돌진행인 명 날벼락,Social
단독 학대 장애인시설 내부고발 의심 직원 폭행까지,Social
전두환 자녀들 상속포기역사책임 손자녀엔 묻지 않을 것,Social
원숭이두창 첫 공식안건 논의국내 감시체계 강화한다,Social
일반공개 앞둔 청와대 관저 내부 미리보기뉴시스,Social
단독 술 주문하고 경찰 신고 협박돈 뜯어낸 중학생들 검거,Social
경찰차 에워싸도 쿨쿨신호 앞 우두커니 수상한  알고보니영상,Social
풀뿌리 언론 살리지 못했다는 분노 자책에 숨겨온 고통 끝낼 수 있을까,Social
금전 문제로 다투다억 빚 아들 어머니 살해 혐의 구속,Social
인도 덮친 만취 화물차보행자 명 사망명 중상,Social
여기는진주 담당 형사다보이스피싱 조직 등친 대,Social
법무부는 차 인사 검증만한동훈 중간보고 안 받는다,Social
슈퍼 파워 불구 견제받지 않는 한동훈 법무부에 우려 목소리 확산,Social
거제 헬기 추락 정비사 명 살리고 떠나다,Social
삼성 자회사 반도체 기술 중국 유출억 챙긴 일당 기소,Social
두 아들 살해 엄마 우울증 치료비로 아이들 맛있는 것 사주고 싶었다,Social
년간 새마을금고 고객 돈 억 횡령압박감에 자수,Social
김동연측 김은혜 억 재산 축소 신고 선관위에 이의 제기서 제출,Social
년 돌본 중증장애 딸 살해하고 극단선택 시도 엄마법원 구속영장 기각,Social
자막뉴스 이런 우연이 낚시꾼이 건져 올린 건,Social
빽 있다 호선 폭행 왕따 당해 큰 후유증 눈물의 진술,Social
집무실 입구서 대통령 책상까지 출입문도 달라,Social
년 돌본 장애딸 살해  구속영장 기각범행 동기 고려,Social
소통령 상왕 부처 후폭풍전문가들 인사검증을 왜 법무부가 해야 하나,Social
조무사 실습 때 노인 싫어져 지하철 휴대폰 폭행 대 항변,Social
공직자 인사검증 단장은 검사한동훈 중간보고 안 받을 것,Social
대기시간만 시간 손흥민 보러 가는 길은 험난했다,Social
윤핵관 사촌 특혜 의혹 강릉시장 후보와 경포 공원,Social
전두환 자녀들 모두 상속포기 단체 손자까지 책임 안 묻겠다,Social
한동훈 권한집중비판 의식했나인사정보관리단 삼청동 설치 검토,Social
선량한 사람들도 빠지는 성차별 함정 소셜 코리아,Social
조선왕릉서 역사 공부거리두기 풀리니 인기,Social
중학교 석차 평가 안 하는데학원 장학금 이유로 확인 요구,Social
대 중증 장애 딸 살해 대 친모 영장기각,Social
쇼핑하는척 치마 아래로 찰칵불법촬영 잡고보니영상,Social
바다에 버린 마약 주사기낚시객에 덜미,Social
담당 형사다보이스피싱 조직 등친 대,Social
단독 김관영 도지사 후보 석사 논문 표절 의혹문장 개 동일,Social
개 나라 확산 원숭이두창 국내 유입 대비 본격화,Social
같이 살지 못해 미안해 뇌병변 대 딸 살해한 친모 구속영장 기각,Social
동창생 성노예로 부리다 숨지게 한 대 항소심서 형량 늘었다,Social
년 돌본 장애 딸 살해한 친모 판사가 구속 안 한 이유,Social
바다에 버린 마약 주사기낚시객에 덜미,Social
이예람 중사 특검 특검보 명 임명유병두이태승손영은,Social
명동 사채왕 계략에 마약사범 누명 국가배상 소송은 패소,Social
추천부터 검증까지  출신이 정부인사 장악,Social
말다툼하다 홧김에대낮에 동거 흉기 살해한 대 체포,Social
바다에 버린 마약 주사기낚시꾼 바늘에 걸려 덜미,Social
조국 사직 요청 받아주지 않아 월급 받는 것서울대 사의 표명 없었다,Social
급 장애 딸 살해 대 친모 구속영장 기각 삶 포기 않겠다 밝혀,Social
년 돌본 뇌병변 장애 딸 살해한 친모 구속영장 기각,Social
