titles,category
조국 날 거짓말쟁이로 몰아사직의사 분명히 표명,Social
청와대 본관관저 시민들에 활짝대통령 된 느낌이에요,Social
한동훈 조국 시절 생긴 형사사건 공개금지 규정 개정 지시,Social
버닝썬 빅뱅 전 멤버 승리 징역 년 개월민간교도소 간다 종합,Social
대법 임금피크제 정년연장 등 반대급부 없다면 무효,Social
격리자 투표는 일과 일 오후 시 분터일반선거인과 시간대 분리,Social
프로필 박순애 교육부 장관인수위 출신 행정조직 전문가,Social
연령 기준만 적용한 임금피크제는 무효 대법원 첫 판단,Social
횡령범 단골 멘트 돈 다 썼다변제 여부가 처벌 가른다,Social
단독 쇼핑몰서 고가 가전 무통장 입금 판매 후 잠적경찰은 주 후 수사 착수한다고,Social
단독서민대책위 민주당 소속 서울시 구청장 후보 명 경찰 고발,Social
중국산 미용용품    붙여 억대 수출한 업체 적발,Social
실감 안나는 여름 재유행 하반기 만만 확진이유 가지,Social
타설장비 낙하 근로자 명 사망경찰 펌프카 운전기사 입건,Social
교통정리 중인 나체녀 등장대낮에 도로 한복판에서 무슨 일,Social
코로나가 끝이 아니다인류 위협하는 인수공통 감염병,Social
서울시교육감 강신만 후보 사퇴 조희연으로 단일화,Social
고깃집 환불 갑질 목사모녀 재판 악어의 눈물합의 없다,Social
양담소 아버지가 남긴 두개의 유언장 어느 쪽이 효력이 있을까요,Social
대법 연령 차별 위법 임금피크제 무효 산업계 혼란 불가피,Social
인천서 낚시객 명 사망명 실종해경 이틀째 수색,Social
도박성매매 빅뱅 승리 징역 년 개월 확정,Social
퇴근 길에 시민 생명 구한 해군기동전단 화천함 장병들,Social
택시비 만원 가져온다던 아가씨그대로 먹튀 하네요,Social
프로필김승희 복지장관 후보식약처장 출신 의약전문가,Social
전입 한 달도 안된 여군 성폭행한 전직 해병대 부사관 집유,Social
민주당전남 무소속 후보들 선거 후 복당 신경전,Social
대법 합리적 이유 없는 임금피크제는 연령차별노사 합의해도 무효종합,Social
프로필 박순애 사회부총리 겸 교육부장관 후보자공공행정 전문가,Social
대법 임금피크제 합리적 보상 없으면 나이 차별,Social
차례 음주 걸리고 또 음주운전한 대 의사 징역형,Social
정차 요구 불응 도주 중 순찰차 들이받은 대 입건,Social
신고당할래 돈 줄래 신분 속이고 술 주문한 중학생들의 협박,Social
안산천서 잉어 떼죽음빗물과 함께 도로변 오염물질 유입 추정,Social
년 뒤 똑같이 미성년 성추행한 경찰공무원,Social
성매매원정도박 승리 징역 년개월 확정 민간교도소 이감상보,Social
산림청 국유림 명품숲 대관령 특수조림지 등 곳 선정,Social
박지현 최강욱 문제 오늘 중 논의 필요하다면 비상징계 권한도 활용,Social
대법원 연령만 기준 삼는 임금피크제는 위법년 만에 첫 판단,Social
속보대법 연령기준 임금피크제는 무효노사 간 협상 불가피,Social
작년 식욕억제제 사용 국내 환자 만명명 중 명 꼴,Social
년 뒤 똑같이 미성년 성추행한 경찰공무원,Social
성매매원정도박 승리 징역 년개월 확정 민간교도소 이감상보,Social
산림청 국유림 명품숲 대관령 특수조림지 등 곳 선정,Social
박지현 최강욱 문제 오늘 중 논의 필요하다면 비상징계 권한도 활용,Social
대법원 연령만 기준 삼는 임금피크제는 위법년 만에 첫 판단,Social
속보대법 연령기준 임금피크제는 무효노사 간 협상 불가피,Social
승리 대법서 년 개월 실형 확정민간교도소로 이감,Social
하루 수회 띠링선거철 공해같은 전화문자폭탄,Social
경운기 타고 고사리 캐러 가다음주 차량에 부부 참변,Social
해병대 부사관 시절 후배 유사강간강제추행 대 집행유예,Social
승리 징역 년개월 확정성매매 알선 등 개 혐의 유죄,Social
빅뱅 승리 민간교도소 간다대법원 년개월 확정,Social
대법 임금피크제는 연령 차별첫 무효 판단,Social
대중제 골프장 그린피 년 새 캐디피도  넘게 올라,Social
제주 동부하수처리장 공사 재개 주민 반발로 무산,Social
대법원 임금피크제는 고령자 차별 무효 줄소송 잇따를 듯,Social
면역 떨어지고 재유행 가능성 커지는데 차 접종은,Social
신규 확진 만 명사흘 만에 만 명 아래로,Social
대표성 없는 공무원보수위원회 재구성하라,Social
까치집 때문에서울 영등포동 아파트 세대 정전,Social
지하철 휴대폰 폭행 대 간호조무사 실습때 노인 싫어져징역 년 구형,Social
경력의 힘피싱범 속여 만원 가로챈 전직 피싱범,Social
전교조 중도보수 교육감 후보 명 명예훼손 혐의 고소,Social
경기도 자립준비청년에 만원 지원전국 최고,Social
조배숙 국민의힘 도지사 후보 전북 떠나는 청년 붙잡겠다,Social
정선군 내달 한시 임기제 공무원 명 채용,Social
속보 목요일 확진자 주 만에 만 명대,Social
강신만 조희연 지지 후 사퇴서울교육감 진보후보 단일화,Social
참을 수 없는 음주운전의 유혹 번째 적발된 대 의사 결국 실형,Social
보 대법 합리적 이유 없는 연령기준 임금피크제 무효,Social
대기업 채용문 열렸다대그룹 년간 만명 이상 국내 채용,Social
경기도지사 지지도김동연  김은혜 ,Social
만성 형간염 위폐 등 간 밖의 암 위험도 높인다,Social
안좋은 말 하는 줄 알고 귀가 여성 무차별 폭행한 대 남성 검거,Social
오피스텔 빌려 년간 성매매 창원서 업주 명 송치,Social
성매매 알선해외 원정도박 빅뱅 승리 징역 년 개월 확정,Social
확진 만명 주만에 최소위중증 명사망 명,Social
현장 성매매 알선 승리 징역 년개월 확정자동전역민간교도소 이감종합,Social
대법원 합리적 이유 없이 연령에 따라 임금 깎는 것은 무효,Social
경찰 인사철에 짙어진 검수완박 그림자수사통 불리 관측도,Social
프로필 오유경 식약처장 산학 거치며 유리 천장 깬 과학자,Social
속보 대법 임금피크제는 연령 차별현행법 위반,Social
법무연수원 간 추미애 간부들 친윤석열 기획부장 지시받는다,Social
빅뱅 전 멤버 승리 징역 년개월 확정민간교도소 이감,Social
일째 만명 밑으로 뚝코로나 신규확진 만명 종합,Social
스포티비 운영사 대표 검찰 송치 회삿돈 억 빼돌려,Social
신문브리핑  코로나가 부른 잔인한 월사망자 최다 외 주요기사,Social
사이드미러끼리 살짝 닿았는데뇌진탕이라며 일간 입원,Social
차례 걸리고 또 만취 운전한 의사 징역형,Social
경남경찰 오피스텔에서 성매매 알선한 업주 명 적발,Social
분 안에 돈 가져올게요택시비 만원 먹튀한 손님,Social
동창생에 성매매 번 강요해 숨지게 한 대 실형,Social
신규 확진 만명 평일도 만명대위중증 명종합,Social
사전투표율이 승부 가른다부산 여야 모두 사전투표 독려,Social
번 성매매 감금 학대동창 숨지게 한 대 항소심서 더 높은 형량,Social
창원서 신호위반  횡단보도 보행자 덮쳐중학생 사망,Social
김태열의 생생건강펜 만성 형간염 환자 간암  위폐암대장암 위험도 높여,Social
초등생도 스마트폰 중독 심각초등 학년  위험군,Social
속보 대법 노사 합의 임금피크제 나이만 기준으로 했다면 위법,Social
프로필 김승희 복지장관 후보자의원식약처장 거친 기술관료 출신,Social
속보 승리 대법서 징역 년 개월 확정민간교도소 이관,Social
광주서 보행자 교통 사망사고 잇달아 발생각별히 주의해야,Social
전장연 삭발식오체투지 지하철 시위 이어가 뉴시스,Social
미대 출신 세 여성 청소부 월수입 만원 이상아파트도 샀다종합,Social
속보 병장 승리 민간교도소 갇힌다징역 년개월 확정,Social
아산시장 선거 만 자족도시 완성  년 민주당 정권 끝내야,Social
살아있어 미안 이근 근황 아직 우크라에 있다 악에 맞서 싸워,Social
신문브리핑   용퇴 논의하자 지도부 자질 없다 그럼 저 왜 앉혔나 외 주요기사,Social
 손순호 기장 지구 바퀴 거리 무사고 운행,Social
도박성매매 빅뱅 전 멤버 승리 징역 년개월 확정,Social
중국산 미용품 국산으로 속여 수출 업체 적발,Social
속보대법 합리적 이유 없는 임금피크제는 연령 차별고령자고용법 위배,Social
원숭이두창 계속 번지는데  방역당국 백신은 제한적으로 사용,Social
보 대법 연령 기준만 적용한 임금피크제는 무효,Social
서울교육감 진보 후보 조희연강신만 단일화강신만 사퇴,Social
돌연 제동 간호법지선 앞두고 의사 반발 부담,Social
년 돌본 중증장애 딸 살해한 엄마구속영장 기각,Social
대법 합리적 이유 없는 연령기준 임금피크제 무효,Social
대전 스마트시티 챌린지사업 전기화재 예방 서비스 성과,Social
 손순호 기장 지구 바퀴 거리 무사고 운행,Social
도박성매매 빅뱅 전 멤버 승리 징역 년개월 확정,Social
중국산 미용품 국산으로 속여 수출 업체 적발,Social
속보대법 합리적 이유 없는 임금피크제는 연령 차별고령자고용법 위배,Social
원숭이두창 계속 번지는데  방역당국 백신은 제한적으로 사용,Social
보 대법 연령 기준만 적용한 임금피크제는 무효,Social
서울교육감 진보 후보 조희연강신만 단일화강신만 사퇴,Social
돌연 제동 간호법지선 앞두고 의사 반발 부담,Social
년 돌본 중증장애 딸 살해한 엄마구속영장 기각,Social
대법 합리적 이유 없는 연령기준 임금피크제 무효,Social
대전 스마트시티 챌린지사업 전기화재 예방 서비스 성과,Social
속보 대법원 임금피크제 연령 차별해 현행법 위반,Social
윤석열 대통령 기업인들과 소통의 장 마련,Social
속보 사회부총리 겸 교육부 장관 후보자에 박순애 서울대 행정대학원 교수,Social
올해 교통사고 감정사 자격시험 월 실시,Social
신문브리핑  미국 본토 겨냥한  한국 노린  처음 섞어 쐈다 외 주요기사,Social
대법 업무 차이 없는 임금피크제는 연령 차별 현행법 위반,Social
집에서 돈 가져온다더니택시비 만원 먹튀한 손님,Social
원주시 공무원노조 강원도청은 부당한 시험감독관 차출 멈춰야,Social
로봇이 회진방역까지삼성서울병원 로봇 지능형병원 선포,Social
대법 업무 같다면 임금피크제는 연령 차별현행법 위반,Social
우크라이나 참전 이근 벌금형 예상 재참전은 쉽지 않아,Social
코로나 신규 확진자 만명 화이자 북한에 백신 원가 공급,Social
대법 합리적 이유없는 임금피크제 연령 차별노사합의 했어도 무효,Social
서대구역 개통 축하 음악회 개최,Social
오피스텔서 년 동안 성매매 알선한 업주 명 적발,Social
차례 걸리고 또 음주운전한 대 의사측정 거부해 징역형,Social
신규 확진 감소세 유지 사망자도 나흘 연속 명 이하종합,Social
독도새우로 알려진 도화새우 만 마리 방류,Social
서울교육감 선거 조희연 지지율 늘고 부동층 줄었다,Social
경남 하루 코로나 확진자 명,Social
내달 일부터 가사도우미도 퇴직금대보험유급휴가 받는다,Social
사천경찰 전화금융사기 상습 전문 현금수거책 대 구속,Social
가사근로자도 대 보험 가입최저임금 적용유급휴가 줘야,Social
한반도 첫수도 고창밥상 땅물불 테마로 전국에 소개,Social
윤석열이 검찰 특수활동비 금고지기를 대통령실로 데려간 이유,Social
내달 일부터 가사근로자도 유급휴일연차휴가 등 보장,Social
윤호상 서울교육감 후보 보수 진영 단일화 간곡히 요청,Social
술 마시고 바다에 빠진 대 구조생명 지장 없어,Social
김건희 여사 조만간 봉하 찾아 권양숙 여사 예방,Social
서울교육감 선거 조희연 지지율 늘고 부동층 줄었다,Social
경남 하루 코로나 확진자 명,Social
내달 일부터 가사도우미도 퇴직금대보험유급휴가 받는다,Social
사천경찰 전화금융사기 상습 전문 현금수거책 대 구속,Social
가사근로자도 대 보험 가입최저임금 적용유급휴가 줘야,Social
한반도 첫수도 고창밥상 땅물불 테마로 전국에 소개,Social
윤석열이 검찰 특수활동비 금고지기를 대통령실로 데려간 이유,Social
내달 일부터 가사근로자도 유급휴일연차휴가 등 보장,Social
윤호상 서울교육감 후보 보수 진영 단일화 간곡히 요청,Social
술 마시고 바다에 빠진 대 구조생명 지장 없어,Social
김건희 여사 조만간 봉하 찾아 권양숙 여사 예방,Social
승리 민간교도소 가나오늘 대법원 선고,Social
부산 도심서 귀가여성 무차별 폭행한 남성 사흘만에 검거종합,Social
다 벗고 교통정리 나섰다나체녀 등장에 운전자들 깜짝,Social
전장연 삭발식오체투지 지하철 시위 이어가국가 책임 촉구,Social
속보 확진 만명목요일 주 만에 만명대,Social
대 젊은 불량배 바둑두는 대 노인 폭행상습 갈취,Social
정차 요구 무시하고 도주하다 순찰차 들이받은 운전자 체포,Social
서울시 퀴어축제 승인 시민위에 넘긴다조직위 성 소수자 차별,Social
차례 처벌 받고 또대 의사 음주 뺑소니측정 거부 징역 년,Social
차례 걸리고도 또음주운전한 대 의사 징역형,Social
구례군 지리산정원 소나무숲 하늘정원 산책길 걸어보세요,Social
경찰 억 횡령 스포티비 운영사 에이클라 대표 송치,Social
주말효과 사라지는 목요일 주 만에 만명대 확진상보,Social
조광한 남양주시장 북 콘서트 연다 공직자 오지 말라 왜,Social
성매매 알선 승리 오늘 대법 선고실형 확정시 민간교도소 이감,Social
만명 확진 일째 만명 아래확진자 일 사전투표종합,Social
코로나 신규확진 만명위중증 명사망 명,Social
신규 확진 만명일 만에 평일 확진자 만명대,Social
신규확진자 만명 지난주 대비 명 감소종합,Social
신규 확진 일 연속 만명 이하 전일 대비 여명상보,Social
거리두기 해제 후 일 코로나 신규확진 만명,Social
모친 계단서 사망 신고 아들 내가 밀었다 자백교통사고도 수상,Social
손흥민에 네이마르는 못 참지 만명 몰린 축구협회 서버 또 터졌다 라인업,Social
 야동서 실제 성행위 금지되나 촬영 규제법안에 시끌,Social
서울시 시내버스 사업 먹튀 막는다주식영업 양수도 기준 마련,Social
인권위 안승남 구리시장 후보 경찰에 수사 의뢰,Social
최계운 조전혁 임태희 교육감후보 돌봄 조 펀드 공약,Social
대 코인 거래소서 루나 매매 못한다코인원까지 동참,Social
대구지검  때 처벌받은 사람 명예회복 절차 진행,Social
신규 확진 만 명으로 목요일 주 만에 만 명대위중증 명,Social
조국 서울대 사직서 논란에 나를 거짓말쟁이로 몰다니,Social
조국 날 거짓말쟁이로 몰아서울대에 사직 의사 분명히 밝혔다,Social
신규 확진 만 명대목요일 기준 주만,Social
변호사 못 구해 애먹던 이은해조현수 결국 사선 구했다첫 재판 연기,Social
조국 날 거짓말쟁이로 몰아서울대 사직 의사 분명히 표현,Social
만명 확진 일째 만명 아래사망 명 늘어 명상보,Social
속보 코로나 신규확진 만 명사망자 명,Social
속보 일째 만명 아래 만명 확진사망 명위중증 명,Social
무더운 여름엔 안동 건진국수로 입맛 돋우세요,Social
청소년 스마트폰 중독 더 심각해졌다초등학생도 통제 어려워,Social
아파트 신축현장 타설 중 명 사망 펌프카 기사 입건,Social
줄어드는 코로나 유행세주 중반에도 만명대 확진,Social
선거일은 유급 휴일 우린 왜 출근해야 하지,Social
법원 강용석 빼고 경기지사 후보 토론 방송 실시해선 안 돼,Social
사이드미러 툭 스쳤는데염좌뇌진탕으로 일 입원한 차주영상,Social
이유 없이 남의 가게 불 지른 대 실형,Social
광주 붕괴사고 관련 현대산업개발 대표이사 입건,Social
민주 성남 수사는 정치보복경찰청 항의 방문,Social
기재차관 월 물가 대 전망다음주 민생안정대책 발표,Social
무더운 여름엔 안동 건진국수로 입맛 돋우세요,Social
청소년 스마트폰 중독 더 심각해졌다초등학생도 통제 어려워,Social
아파트 신축현장 타설 중 명 사망 펌프카 기사 입건,Social
줄어드는 코로나 유행세주 중반에도 만명대 확진,Social
선거일은 유급 휴일 우린 왜 출근해야 하지,Social
법원 강용석 빼고 경기지사 후보 토론 방송 실시해선 안 돼,Social
사이드미러 툭 스쳤는데염좌뇌진탕으로 일 입원한 차주영상,Social
이유 없이 남의 가게 불 지른 대 실형,Social
광주 붕괴사고 관련 현대산업개발 대표이사 입건,Social
민주 성남 수사는 정치보복경찰청 항의 방문,Social
기재차관 월 물가 대 전망다음주 민생안정대책 발표,Social
기술 넘어간 종착지는 중국 국영연구소,Social
초등학생 만명 스마트폰 인터넷 중독에 일상생활 못한다,Social
오세훈  국무회의서 쓴소리도 하는 서울시장 될 것,Social
반도체 세정장비 유출 혐의 명 기소,Social
배달앱 악평은 괜찮고 양주 고깃집 갑질 목사모녀 재판서 울먹,Social
미안해 년 돌본 중증장애 딸 살해 대 친모 법원 영장기각,Social
세계가스총회 참관객 눈길 끌기 위해 기업 경쟁 치열,Social
오피스텔서 불법 성매매 일당 년간 억 만원 벌었다,Social
울산서 건물 전체 태운 묻지마 방화범징역 년 선고,Social
자영업 사장님이 왜 노조위원장이 됐나노동자 개념을 묻다,Social
광주전남서 하루새 코로나 확진자 각각 명명 발생,Social
거리두기 일상 무심했던 것들이 비로소 보였다,Social
강원 국힘 곳 싹쓸이보수텃밭으로 회귀 조짐,Social
충북 로 민주국힘 분할곳은 경합지역,Social
대전 민주 확실한 우세 곳도 없어,Social
김형찬 부산 강서구청장 후보 노기태 후보 허위사실 유포로 고발,Social
이근 아직 우크라이나에 있다악에 맞서 싸울 수 있어 기뻐,Social
사천회 억만원 전화사기 현금수거책 구속,Social
오늘부터 청와대 내부 공개대통령 집무실침실도 열린다,Social
교육플러스 보수 인  진보 인서울교육감 후보 인은,Social
헌재 파업이 업무방해죄인가 년 만에 오늘 결론,Social
내일날씨 전국에 강한 바람큰 일교차 주의,Social
빛소음 공해 골프 연습장 자리를 공공주택으로사당역 역세권 주택 개발,Social
한국노총 양산지부 나동연 후보 공개 지지 선언,Social
코로나 후유증 치료법 없다백신 효과는 제한적,Social
충남 민주당 곳국민의힘 곳 우세국힘 약진,Social
노동자 파업은 업무방해죄오늘 년 만에 헌재 판단 나온다,Social
한동훈 조국이 만든 형사사건 공개금지 개정 지시,Social
성매매 알선 빅뱅 승리 오늘 대법원 선고심 징역 년 개월,Social
군위군수 지지 부탁 수백만원 뿌린 후보 처남 구속,Social
서울시 버스회사 줍줍 사모펀드 제동먹튀 방지,Social
조국 저를 거짓말쟁이로 모는군요 서울대 사직 의사 분명히 표명,Social
조국 사직 안받아줘월급 수령서울대 사의표명 없었다,Social
한 사람에게 두번 세번씩 보이스피싱억 편취 대 여성 구속,Social
효과 있다 탈모새치샴푸 뜨자 제약바이오 가세,Social
성매매알선상습도박 빅뱅 승리 오늘 대법원 선고 카지노서 빌린 칩 상당액 추징 여부 쟁점,Social
병장 승리 오늘 대법 선고유죄땐 민간교도소에 갇힌다,Social
김영만 군수 지지해달라 돈봉투 건낸 군수 친인척 구속 ,Social
아무 이유없이 방화 동네 가게 불 지른 대 징역 년,Social
지방선거 전라남도지사 김영록이정현김영록 독주속 이정현 선전 주목,Social
조국 서울대 사직서 논란에 나를 거짓말쟁이로 몰다니 펄쩍,Social
황운하 허위사실 공표 고발에 김광신 고발 즉시 역고발,Social
영상 청와대 요리사가 대통령 얘기에 눈물 쏟은 사연 노무현의 입맛박근혜의 스타킹,Social
한동훈 상설특검으로 검수완박 무력화 나설까,Social
구사일생 에이프릴바이오얼어붙은 바이오 투심 돌리나,Social
이슈분석 법무부 인사검증 권한 놓고 논란,Social
임금피크제 무효 여부 오늘 대법원 첫 판단,Social
전자발찌 훼손살해 강윤성 오늘 국민참여재판 받는다,Social
대낮 음주운전 트럭이 행인 덮쳐명 사상,Social
전두환 자녀 유산상속 포기손자녀도 포기 절차 검토,Social
아무 이유 없이 남의 건물에 불 지른 대 징역년,Social
날씨 서울 도 더위 한풀 꺾여중부 강풍 주의,Social
아침에 한 장 야외 수영장이 돌아온다,Social
감자 수급도 불안패스트푸드점서 또 사라진 감자튀김,Social
검찰총장 직무대리가 기억의 벽 찾은 까닭은,Social
어릴 적 모습 그대로 꿈에년 이상 장기실종 아동 여명,Social
공룡 피자 요청 승낙한 사장님 감사 리뷰진상 누리꾼 싸늘,Social
어머니 사망 신고한 대 아들 계단서 밀었다 살해 자백,Social
메갈페미라 욕먹던 걔네들이 선거에 나왔다,Social
같이 살지 못해 미안해 년 돌본 뇌병변 딸 살해한 구속영장 기각,Social
핫클릭 누리호 차 발사예정일 월 일로 최종 확정 ,Social
년 반만의 총출동 새 정부 첫 국무회의 앞둔 세종 풍경,Social
단속반 뜨면 초 도망만원도 못 벌지만 돗자리 펼치는 노점상들,Social
진중권  사저 앞 극우시위에 집회의 자유 빙자한 폭력,Social
동창생 감금하고 몹쓸짓 시켜 돈 갈취한 대형량 더 늘어난 이유,Social
사이드미러 스쳤는데 뇌진탕에 입원까지거부해야영상,Social
출근길 대 운전 차량 가로수 들이받고 전도음주 들통,Social
영상 집에서 돈 가져올게요택시비 만 원 먹튀한 손님,Social
전자발찌 꾾고 여성 명 살해 강윤성 오늘 국민참여재판 열려,Social
메갈페미라 욕먹던 걔네들이 선거에 나왔다,Social
같이 살지 못해 미안해 년 돌본 뇌병변 딸 살해한 구속영장 기각,Social
핫클릭 누리호 차 발사예정일 월 일로 최종 확정 ,Social
년 반만의 총출동 새 정부 첫 국무회의 앞둔 세종 풍경,Social
단속반 뜨면 초 도망만원도 못 벌지만 돗자리 펼치는 노점상들,Social
진중권  사저 앞 극우시위에 집회의 자유 빙자한 폭력,Social
동창생 감금하고 몹쓸짓 시켜 돈 갈취한 대형량 더 늘어난 이유,Social
사이드미러 스쳤는데 뇌진탕에 입원까지거부해야영상,Social
출근길 대 운전 차량 가로수 들이받고 전도음주 들통,Social
영상 집에서 돈 가져올게요택시비 만 원 먹튀한 손님,Social
전자발찌 꾾고 여성 명 살해 강윤성 오늘 국민참여재판 열려,Social
명한테 차례 억 받아 건낸 전화금융사기범 검거,Social
올여름 코로나 재유행 유력한데방역 당국 전 국민 차 접종 검토할까,Social
뉴스쏙속북한 결국 선 넘나차 핵실험 임박,Social
옥중 김경수  프로필 사진 교체페북 정치 시작,Social
김석준 딸 입학 아빠찬스 의혹 하윤수 조국 옹호 자격 있나,Social
친환경 정책 줄줄이 제동탄소중립 속도조절,Social
가수 승리 오늘 대법원 판결 받는다,Social
전자발찌 끊고 명 살인 강윤성 오늘 국민참여재판빠르면 당일 선고,Social
오스템임플란트새마을금고아모레퍼시픽강동구청계양전기간큰 횡령 잇따르는 이유 있다,Social
영상 돈 가져올게요 분 안에 온다더니 택시비 먹튀,Social
윤 대통령 교육  복지장관에 여성 우선 발탁 방침,Social
남자랑 술 마셔 결혼 앞두고 약혼녀 시간 감금폭행한 대,Social
오피스텔 공사현장서 대 작업자 추락사,Social
담당 형사다보이스피싱 조직 등친 대,Social
영수증 장이면 사장님 개인정보 탈탈제보 확인해보니,Social
전자발찌 살인 강윤성 오늘 국민참여재판배심원 판단 받는다,Social
조국 서울대에 사직 의사 분명히 표명거짓말쟁이로 몰아,Social
피해 여성 사진 무단 조회징계 전력자 요직 발탁 논란,Social
조국 직위해제 월급 논란에 사직 표명했다서울대 그런 적 없다,Social
인터넷 와글와글전두환 자녀 상속 포기차가 인도로 왜급소 피해 살았다,Social
